platform,post_id,title,author,created_date,score,comments_count,severity,url,tags,content_preview
stackoverflow,76392981,Cookie Based Authentication - Creating a secure response header,user7934593,2023-06-03T00:51:18,0,0,critical,https://stackoverflow.com/questions/76392981/cookie-based-authentication-creating-a-secure-response-header,"javascript, authentication, cookies, exploit",<p>I am implementing cookie based authentication on my tls webserver. Though I am still a bit unsure if this response header creates a secure cookie based authentication?</p> <p>My goal is to disable ...
stackoverflow,26444284,vTiger CRM 6 + LDAP Authentication,Kris,2014-10-19T02:04:00,0,1,critical,https://stackoverflow.com/questions/26444284/vtiger-crm-6-ldap-authentication,"php, authentication, ldap, vtiger, exploit","<p>I exploited the last days, but I wasn't able to find a real useful tutorial to intigrate LDAP Authentication into a vTiger CRM 6 (running on a Linux CentOS 6.5 distribution).</p> <p>Any one experi..."
stackoverflow,21320295,How should I go about authenticating an application via HTTP?,aman207,2014-01-24T03:34:26,0,1,critical,https://stackoverflow.com/questions/21320295/how-should-i-go-about-authenticating-an-application-via-http,"java, security, authentication, exploit","<p>I'm making an application that requires it to be authenticated on startup with a ""secret key"" as defined in a configuration file. I can't have the app call to a database so I'm thinking I need to d..."
stackoverflow,14472023,User Authentication/Login using OAuth,Taj Morton,2013-01-23T09:03:29,0,1,critical,https://stackoverflow.com/questions/14472023/user-authentication-login-using-oauth,"security, web-applications, authentication, oauth, exploit","<p>I feel like this might be answered in another OAuth question here, but I couldn't find it...</p> <p>I have implemented an OAuth provider on a web service I'm writing. OAuth consumers of my provide..."
stackoverflow,32905696,How to avoid showing consent screen in our own native apps when external authentication?,David Ernstsson,2015-10-02T16:27:37,5,2,critical,https://stackoverflow.com/questions/32905696/how-to-avoid-showing-consent-screen-in-our-own-native-apps-when-external-authent,"android, security, authentication, oauth-2.0, openid-connect, exploit",<h3>Background</h3> <ul> <li>We have developed a web application featuring a rest-api using oauth2/oidc and support for third party apps</li> <li>We have developed our own native apps for android and ...
stackoverflow,2089526,"FormsAuthentication and setting the userID/name in an encrypted cookie, security risk?",mrblah,2010-01-19T03:27:18,1,1,critical,https://stackoverflow.com/questions/2089526/formsauthentication-and-setting-the-userid-name-in-an-encrypted-cookie-security,"asp.net, security, authentication, cryptography, cookies, exploit","<p>Asp.net stores the session in a cookie, thus not having to worry about sessions on the server side (traditionally sessions are stored in a database, and lookups are done via a session ID, which is ..."
stackoverflow,11464458,What to do when a logged in user goes back to the log in page?,Question Overflow,2012-07-13T10:39:11,1,4,critical,https://stackoverflow.com/questions/11464458/what-to-do-when-a-logged-in-user-goes-back-to-the-log-in-page,"authentication, logout, user-experience, exploit",<p>I found three different approaches on various websites that requires a user to log in:</p> <ol> <li>Log out a user who goes back to the log in page</li> <li>Redirect the user to a welcome page</li...
stackoverflow,22846608,Android apps persistent authentication,Krum110487,2014-04-04T00:31:44,0,1,critical,https://stackoverflow.com/questions/22846608/android-apps-persistent-authentication,"android, ios, authentication, oauth, exploit","<p>I have recently started toying with an android application, and I have gotten to the point where I want it to communicate with a web service, I understand completely how to do this in an insecure w..."
stackoverflow,11689156,How to take userid or email input and validate in servlet,Mistu4u,2012-07-27T19:19:53,1,1,critical,https://stackoverflow.com/questions/11689156/how-to-take-userid-or-email-input-and-validate-in-servlet,"jakarta-ee, servlets, authentication, exploit",<p>My question is simple. In some websites it is seen one can enter the site providing his/her email-id or userid and password(i.e already registered with the site). Now in MVC structure we use servle...
stackoverflow,8339506,What are the possible ways to authenticate user when websocket connection is used?,Burak Dede,2011-12-01T15:34:54,19,3,critical,https://stackoverflow.com/questions/8339506/what-are-the-possible-ways-to-authenticate-user-when-websocket-connection-is-use,"python, authentication, chat, websocket, tornado, exploit",<p>Example scenario: Web based multi-user chat application through websocket connection. How can I ensure (or guarantee) that each connection in this application belongs to certain authenticated user ...
stackoverflow,63103871,Should the client authenticate on every route?,Sir Rubberduck,2020-07-26T23:36:45,0,2,critical,https://stackoverflow.com/questions/63103871/should-the-client-authenticate-on-every-route,"javascript, node.js, rest, authentication, jwt, exploit","<p>There's a JWT in localStorage.</p> <p>Let's say the user goes to <code>app.com/accounts</code>.</p> <p>The JWT is sent to the backend <code>app.com/api/accounts</code> for the data, and before it r..."
stackoverflow,45043441,Association of OAuth between providers,Robert Vangor,2017-07-12T01:23:52,0,1,critical,https://stackoverflow.com/questions/45043441/association-of-oauth-between-providers,"authentication, facebook-graph-api, oauth, oauth-2.0, google-oauth, exploit","<p>I was looking at Khan Academy and I'm wondering how their authentication works (probably many other websites have it the same). </p> <p>When you login with facebook account that has email ""aaa@gma..."
stackoverflow,58993158,JHipster: JWT and Wordpress,mgu,2019-11-22T16:48:03,0,0,critical,https://stackoverflow.com/questions/58993158/jhipster-jwt-and-wordpress,"wordpress, spring-boot, authentication, jwt, jhipster, exploit","<p>I have a new JHipster project initialized with JWT Authentication.</p> <p>I'd like to integrate my application with my Wordpress site authentication. Also, I don't want to use external providers l..."
stackoverflow,59464249,"Access Azure APIM only via Trusted Android, iOS &amp; Web Apps",vinay,2019-12-24T11:04:53,0,1,critical,https://stackoverflow.com/questions/59464249/access-azure-apim-only-via-trusted-android-ios-web-apps,"android, ios, azure, authentication, azure-api-management, exploit","<p>We have Android, iOS and Azure Web app for our system which will be calling Azure APIM which is created for Azure API APP.</p> <p><strong>Problem statement is :</strong> APIM should only be acces..."
stackoverflow,35070728,How do I prevent a user from accessing a server&#39;s API directly and instead force them to use the UI?,honorableruler,2016-01-29T01:21:15,2,2,critical,https://stackoverflow.com/questions/35070728/how-do-i-prevent-a-user-from-accessing-a-servers-api-directly-and-instead-force,"authentication, http-headers, httprequest, exploit","<p>More of a theoretical question, but I'm really curious! </p> <p>I have a two part application:</p> <ol> <li>Apache server hosting my UI </li> <li>Back-end that services all http requests from the..."
stackoverflow,62417429,android trust manager vulnerability,Rafael Lima,2020-06-17T02:24:35,8,0,medium,https://stackoverflow.com/questions/62417429/android-trust-manager-vulnerability,"android, encryption, google-play, android-security, vulnerability","<p>I received a very disturbing email from google:</p> <blockquote> <p>We reviewed <code>app name</code>, with <code>package name</code>, and found that your app uses software that contains security v..."
stackoverflow,3008139,Why is using a Non-Random IV with CBC Mode a vulnerability?,rook,2010-06-09T22:43:30,48,3,unknown,https://stackoverflow.com/questions/3008139/why-is-using-a-non-random-iv-with-cbc-mode-a-vulnerability,"security, encryption, cryptography, vulnerability",<p>I understand the purpose of an IV. Specifically in CBC mode this insures that the first block of of 2 messages encrypted with the same key will never be identical. But why is it a vulnerability if...
stackoverflow,48233275,How to resolve Sweet32 vulnerability on Apache Tomcat?,M.Clark,2018-01-13T01:33:37,0,1,unknown,https://stackoverflow.com/questions/48233275/how-to-resolve-sweet32-vulnerability-on-apache-tomcat,"apache, security, tomcat, ssl, encryption, vulnerability","<p>I am having some trouble getting rid of a server vulnerability. The Sweet32 vulnerability deals with medium strength cipher suites on my web server. The scanner output reads as follows, ""The remote..."
stackoverflow,28828600,iOS AES Encryption with Vulnerability: Signed Memory Arithmetic,timlwting,2015-03-03T15:18:20,0,0,unknown,https://stackoverflow.com/questions/28828600/ios-aes-encryption-with-vulnerability-signed-memory-arithmetic,"ios, objective-c, security, encryption, aes, vulnerability","<p>I'm using AES encryption to encrypt / decrypt user's info in my app.<br> This is the code I'm using:<br> <a href=""https://gist.github.com/matsuda/9204276"" rel=""nofollow"">https://gist.github.com/mat..."
stackoverflow,45939499,Tomcat TLS Vulnerability Sweet32 Birthday attack,Sulejmani,2017-08-29T18:13:18,1,1,unknown,https://stackoverflow.com/questions/45939499/tomcat-tls-vulnerability-sweet32-birthday-attack,"security, tomcat, ssl, encryption, vulnerability","<p>I have a tomcat service, which doesn't pas a veracode scan. Birthday attacks against TLS ciphers discovered vulnerabilities in Tomcat HTTPS port (8543).</p> <p>After reading some documentation I f..."
stackoverflow,2845986,Does having an unencrypted sha-224 checksum create a vulnerability?,WilliamKF,2010-05-17T05:26:43,2,1,unknown,https://stackoverflow.com/questions/2845986/does-having-an-unencrypted-sha-224-checksum-create-a-vulnerability,"encryption, sha1, checksum, security, vulnerability","<p>If I have a packet of data that is encrypted yet also includes a sha-224 checksum that is not encrypted, am I creating a security vulnerability?</p> <p>Or perhaps the checksum should be produced a..."
stackoverflow,47340151,Is decrypting and setting environment variables inside an AWS Lambda function a vulnerability?,Ten Tentacles,2017-11-17T03:56:27,2,1,unknown,https://stackoverflow.com/questions/47340151/is-decrypting-and-setting-environment-variables-inside-an-aws-lambda-function-a,"amazon-web-services, security, encryption, environment-variables, aws-lambda, vulnerability","<p>Inside of AWS Lambda functions I have some libs that look for sensitive information in the os environment. I can encrypt the env vars using KMS, but I've found myself having to overwrite the encryp..."
stackoverflow,3502734,Can you spot a vulnerability in my authentication protocol?,Petrus Repo,2010-08-17T18:43:35,4,4,medium,https://stackoverflow.com/questions/3502734/can-you-spot-a-vulnerability-in-my-authentication-protocol,"security, authentication, encryption, cryptography, vulnerability",<p>Some time ago we needed a solution for Single Sign On authentication between multiple web services. At least at that time we considered OpenID protocol too complicated and we were not convinced abo...
stackoverflow,1248105,Do many small files encrypted with the same cipher and key pose a security vulnerability?,user34537,2009-08-08T11:36:21,0,5,unknown,https://stackoverflow.com/questions/1248105/do-many-small-files-encrypted-with-the-same-cipher-and-key-pose-a-security-vulne,"security, encryption, vulnerability","<p>I am curious, if I have many files, some as big as a few k, some as little as 2, 4, 8 bytes. Will there be a security hole? What if I have 10,000 files on a single disc all encrypted with the same ..."
stackoverflow,66487085,3DES-Sweet32 Vulnerability Compensating Control(s)?,H.Bustam,2021-03-05T10:34:22,0,1,unknown,https://stackoverflow.com/questions/66487085/3des-sweet32-vulnerability-compensating-controls,"encryption, google-cloud-platform, aws-security-group, 3des, websecurity, vulnerability","<p>For backward compatibility reasons if the 3DES (<code>TLS_RSA_WITH_3DES_EDE_CBC_SHA</code>) cipher needs to be enabled in a web server, is there any compensating security control that can be used t..."
stackoverflow,50479140,Vulnerability Using AES128 with ECB mode of operation,kumarmo2,2018-05-23T08:24:35,0,1,unknown,https://stackoverflow.com/questions/50479140/vulnerability-using-aes128-with-ecb-mode-of-operation,"security, encryption, hash, aes, vulnerability","<blockquote> <p>I need to implement a system where, I will generate a userId/password combination for a user. The userId will be generated using some common logic for all the users. </p> <p>For..."
stackoverflow,7762489,Are Heroku dynos vulnerable to BEAST? (TLS 1.0 CBC exploit),Alec Wenzowski,2011-10-14T08:03:24,5,1,critical,https://stackoverflow.com/questions/7762489/are-heroku-dynos-vulnerable-to-beast-tls-1-0-cbc-exploit,"security, ssl, encryption, heroku, vulnerability","<p>Was reading <a href=""http://www.theregister.co.uk/2011/09/19/beast_exploits_paypal_ssl/"" rel=""nofollow noreferrer"">an article in The Register about BEAST</a> which lead me to the SO post about <a h..."
stackoverflow,53610892,Aren&#39;t all data exchanges through a webserver vulnerable to interception?,xon52,2018-12-04T16:01:32,0,0,critical,https://stackoverflow.com/questions/53610892/arent-all-data-exchanges-through-a-webserver-vulnerable-to-interception,"security, encryption, encryption-asymmetric, vulnerability","<p>As far as encryption protocols go, Whisper Systems has the gold standard - but ultimately, if you had complete access to the server, couldn't you just intercept the very first exchange (of keys) an..."
stackoverflow,26485715,Glassfish 2.0 Poodle vulnerability - How to disable SSL and allow TLS only,user2050516,2014-10-21T17:05:34,3,1,unknown,https://stackoverflow.com/questions/26485715/glassfish-2-0-poodle-vulnerability-how-to-disable-ssl-and-allow-tls-only,"java, ssl, encryption, glassfish-2.x, vulnerability",<p>Is there any JVM option or Grizzly framework config file to prevent SSLv3 connections ? Somehow to disable SSLv3 and allow TLS cipher only. Any other idea is welcome. </p>
stackoverflow,37530614,Is there a vulnerability if the beginning of the plaintext is known before encryption?,RainingChain,2016-05-30T22:29:32,1,1,unknown,https://stackoverflow.com/questions/37530614/is-there-a-vulnerability-if-the-beginning-of-the-plaintext-is-known-before-encry,"node.js, encryption, vulnerability",<p>Assuming this is my encrypt and decrypt function using native <code>crypto</code> from node.js.</p> <pre><code>var algo = 'aes-256-cbc'; var algoSecret = 'mySecret'; var encrypt = function(secret...
stackoverflow,33738292,Vulnerable IV and salt in AES encryption,Onsur,2015-11-16T20:27:29,2,1,unknown,https://stackoverflow.com/questions/33738292/vulnerable-iv-and-salt-in-aes-encryption,"c#, encryption, aes, vulnerability","<p>I'm checking this AES encryption/decryption project <a href=""http://www.codeproject.com/Articles/769741/Csharp-AES-bits-Encryption-Library-with-Salt"" rel=""nofollow"">http://www.codeproject.com/Artic..."
stackoverflow,49296993,How to disable weak ciphers in SSL?,Amar,2018-03-15T15:55:31,0,1,low,https://stackoverflow.com/questions/49296993/how-to-disable-weak-ciphers-in-ssl,"ssl, encryption, vulnerability","<p>We are getting weak cipher vulnerability during system scan and to resolve this I have negated them in string in <code>openssl.conf</code>, but still I am able to connect the local host using these..."
stackoverflow,30722705,why the AES result is different between Crypto and M2Crypto with Python?,Kaly Heven,2015-06-09T09:23:19,1,0,unknown,https://stackoverflow.com/questions/30722705/why-the-aes-result-is-different-between-crypto-and-m2crypto-with-python,"python, encryption, vulnerability","<p>i have two script in python , one is encrypt data using Crypto </p> <pre><code>from Crypto.Cipher import AES from Crypto import Random IV = 'c782dc4c098c66cb' secrect_key = 'c286696d887c9aa0' ci..."
stackoverflow,4418256,RSA- Blinded message scheme still vulnerable?,user427390,2010-12-12T00:01:09,1,1,unknown,https://stackoverflow.com/questions/4418256/rsa-blinded-message-scheme-still-vulnerable,"encryption, rsa, encryption-asymmetric, vulnerability","<p>I know this is more or less an algorithm or design problem and not so much programming, but I hope it's alright.</p> <p>I am using a blinded message and having it signed by C. After the signing I ..."
stackoverflow,6446700,TripleDESCryptoServiceProvider - vulnerable to Denial of Service?,frankadelic,2011-06-23T02:48:22,5,2,medium,https://stackoverflow.com/questions/6446700/tripledescryptoserviceprovider-vulnerable-to-denial-of-service,"encryption, cryptography, denial-of-service, tripledes, vulnerability","<p>We have a legacy ASP.NET site which uses the encryption methods here:</p> <p><a href=""http://www.codekeep.net/snippets/af1cd375-059a-4175-93d7-25eea2c5c660.aspx"" rel=""nofollow"">http://www.codekeep..."
stackoverflow,48740014,SQLite Table-Level Encryption,Sachin Patil,2018-02-12T10:56:46,0,2,high,https://stackoverflow.com/questions/48740014/sqlite-table-level-encryption,"ios, sqlite, encryption, vulnerability",<p>We need to encryption in SQLite to secure our data from vulnerability. Is there any way of table-level encryption in SQLite? we tried to find out but we didn't yet get any solution.</p> <p>Thanks ...
stackoverflow,15838011,Is it vulnerable to ASP Padding oracle,Jagex Online,2013-04-05T21:08:49,1,2,critical,https://stackoverflow.com/questions/15838011/is-it-vulnerable-to-asp-padding-oracle,"asp.net, security, encryption, cryptography, padding-oracle-attack, vulnerability",<ol> <li><p>When I open chat.mysite.com/WebResource.axd?d=jzjghMVYzFihd9Uhe_arpA2 It gives me: Padding is invalid and cannot be removed. </p></li> <li><p>When I open chat.mysite.com/WebResource.axd?...
stackoverflow,57816493,Crittercism Weak SSL Cipher Suites are Supported and Lack of Certificate Pinning,n00bm5st3r69,2019-09-06T11:30:11,0,1,unknown,https://stackoverflow.com/questions/57816493/crittercism-weak-ssl-cipher-suites-are-supported-and-lack-of-certificate-pinning,"react-native, encryption, crittercism, certificate-pinning, vulnerability",<p>Our security team has performed a security scan on our mobile application and found the following vulnerabilities:</p> <pre><code>Vulnerability Name: Weak SSL Cipher Suites are Supported Vulnerabi...
stackoverflow,48371695,PHP - Encryption security concern (Am I vulnerable?),GMBeniamin,2018-01-22T02:33:35,0,1,unknown,https://stackoverflow.com/questions/48371695/php-encryption-security-concern-am-i-vulnerable,"php, encryption, libsodium, vulnerability","<p>I want to connect to ssh via PHP. I can do that easily but the problem is the integrity of the login details (username, password). When I first tried the code I stored my username and password in p..."
stackoverflow,55982277,Is this code vulnerable to a padding oracle attack?,cryptisloveifcandecrypt,2019-05-02T21:41:28,4,1,unknown,https://stackoverflow.com/questions/55982277/is-this-code-vulnerable-to-a-padding-oracle-attack,"c#, encryption, aes, padding, padding-oracle-attack, vulnerability","<p>Is the following code vulnerable to a padding oracle attack, because it will return if the padding is valid or not (CBC, PKCS#7)?</p> <p>The code is taken directly from Microsoft's webpage and can..."
stackoverflow,12025458,Does this render SSL encryption vulnerable?,Schmoopsiepoo,2012-08-19T14:47:43,-2,2,unknown,https://stackoverflow.com/questions/12025458/does-this-render-ssl-encryption-vulnerable,"security, encryption, ssl, cryptography, wireless, vulnerability","<p>From my understanding, prior to secure SSL communications, a symmetric key is established between the two parties. Now, if an SSL session were to involve an unsecure wireless access point, would it..."
stackoverflow,5439919,Example of simple flawed hashing algorithm vulnerable to preimaging attacks,John,2011-03-26T07:38:34,1,2,critical,https://stackoverflow.com/questions/5439919/example-of-simple-flawed-hashing-algorithm-vulnerable-to-preimaging-attacks,"algorithm, encryption, hash, vulnerability","<p>I am looking for an example of a simple hashing algorithm that can be shown to be vulnerable to multiple preimage attacks for a specified input length. </p> <p>For example, if I know that the inpu..."
stackoverflow,26752098,In what ways is this XOR encryption system vulnerable?,Noah,2014-11-05T13:23:09,1,3,critical,https://stackoverflow.com/questions/26752098/in-what-ways-is-this-xor-encryption-system-vulnerable,"security, encryption, xor, password-encryption, vulnerability",<p>I am looking into simple ways to secure the many passwords I have for my online accounts. After some thought I came up with this idea:</p> <ol> <li>Change all my current passwords to be random str...
stackoverflow,63946638,Weak Encryption: Inadequate RSA Padding,dilla,2020-09-18T03:25:49,0,0,unknown,https://stackoverflow.com/questions/63946638/weak-encryption-inadequate-rsa-padding,"encryption, rsa, fortify, secure-coding, weak, vulnerability","<p>The security check tool Fortify has detected vulnerability on the lines</p> <pre class=""lang-cs prettyprint-override""><code>RSAPKCS1SignatureDeformatter deformatter = new RSAPKCS1SignatureDeformatt..."
stackoverflow,5015134,Security: How vulnerable is this authentication/encryption scheme?,Nuoji,2011-02-16T15:46:54,2,5,critical,https://stackoverflow.com/questions/5015134/security-how-vulnerable-is-this-authentication-encryption-scheme,"security, authentication, encryption, cryptography, encryption-symmetric, vulnerability","<p>I have a client-server game, where the client connects to a server and stays connected during the game (approx 5-60 min).</p> <p>I want new clients to be able to register securely, as well as allo..."
stackoverflow,51050674,Does knowing one encrypted character open up a security flaw?,Toby Smith,2018-06-27T01:39:08,0,1,unknown,https://stackoverflow.com/questions/51050674/does-knowing-one-encrypted-character-open-up-a-security-flaw,"php, security, encryption, cryptography, encryption-symmetric, security flaw","<p>One of the columns in a table in my API's database is an encrypted text formed of two pieces of information concatenated with a given delimiter, lets say a colon. The second piece of information is..."
stackoverflow,7905641,Does the XML Encryption flaw affect WCF X.509 certificate-based security?,zimdanen,2011-10-26T21:47:51,1,2,unknown,https://stackoverflow.com/questions/7905641/does-the-xml-encryption-flaw-affect-wcf-x-509-certificate-based-security,"xml, wcf, encryption, security flaw","<p>A ""practical attack against XML's cipher block chaining (CBC) mode"" has been demonstrated:</p> <p><a href=""http://www.informationweek.com/news/security/vulnerabilities/231901532"" rel=""nofollow"">ht..."
stackoverflow,42862622,Is this a common or flawed security practice?,Kevin,2017-03-17T21:57:48,1,0,unknown,https://stackoverflow.com/questions/42862622/is-this-a-common-or-flawed-security-practice,"node.js, security, network-programming, encryption, server, security flaw",<p>I would like user authentication to take place in the following way:</p> <ul> <li>User generates an encryption key and keeps it on their device. The key is then encrypted by their password.</li> <...
stackoverflow,57750003,R-Project sent me my unencrypted password in plain text,Tim Smaluk,2019-09-02T04:17:16,2,0,unknown,https://stackoverflow.com/questions/57750003/r-project-sent-me-my-unencrypted-password-in-plain-text,"r, email, security, encryption, passwords, security flaw","<p>I just received an email from the R-Project, an email subscription service that sends out emails for R question, and they sent me my password, unencrypted, in plain text. Is this a security flaw, a..."
stackoverflow,16160273,Random Number Seed Generator: Using System On Time,user1257724,2013-04-23T08:42:14,1,3,critical,https://stackoverflow.com/questions/16160273/random-number-seed-generator-using-system-on-time,"c, security, encryption, random, rsa, security flaw","<p>I'm trying to understand why this code is a security flaw. From my understanding, it is not safe to generate a random number seed using the system time when the program is turned on, but how is tha..."
stackoverflow,5102825,zip encryption on the ipad,Praveen Sripati,2011-02-24T15:10:08,0,2,unknown,https://stackoverflow.com/questions/5102825/zip-encryption-on-the-ipad,"ipad, encryption, zip, security flaw","<p>Is there a support for zip with encryption on the iPad? Also, looks like there are security flaws in using zip with encryption. Could you someone give some information on this?</p> <p>Thanks, Prav..."
stackoverflow,26050202,Security of MATLAB Compiler,fixingstuff,2014-09-26T05:56:23,2,1,critical,https://stackoverflow.com/questions/26050202/security-of-matlab-compiler,"matlab, security, encryption, matlab-deployment, matlab-compiler, security flaw",<p>I am interested to hear how secure the source code is when compiled with MATLAB Compiler as of 2014? I read two threads on the subject from 2011 that states that there are security flaws.</p> <p>I...
stackoverflow,496152,AJAX Security Norm,srmark,2009-01-30T22:00:10,4,3,unknown,https://stackoverflow.com/questions/496152/ajax-security-norm,"javascript, ajax, security, encryption, security flaw","<p>Is there a norm for AJAX security? </p> <p>When making an XMLHttpRequest, if querying an HTTPS url, will the browser handle all the certificate business and properly encrypt the request (or use ..."
