platform,post_id,title,author,created_date,score,comments_count,severity,url,tags,content_preview
stackoverflow,20573918,Admin panel of the website is being accessed without verification,Hamza Rabbani,2013-12-14T00:24:10,0,1,high,https://stackoverflow.com/questions/20573918/admin-panel-of-the-website-is-being-accessed-without-verification,"php, security, authentication, vulnerability",<p>Admin panel is working fine for normal users! It requires password to access it but when I access it using acunetix's http editor it opens the admin panel without verification. I'm using a function...
stackoverflow,50804803,Session Management Socket.io,Alk,2018-06-12T01:00:48,0,0,unknown,https://stackoverflow.com/questions/50804803/session-management-socket-io,"node.js, session, authentication, socket.io, vulnerability","<p>I'm trying to implement sessions in my <code>node.js</code> app which makes heavy use of <code>socket.io</code>. I'm struggling with this currently, and found a rather simple solution which recomme..."
stackoverflow,77338624,auth. Refresh token and access token flow?,learner_0111,2023-10-22T09:48:54,0,1,unknown,https://stackoverflow.com/questions/77338624/auth-refresh-token-and-access-token-flow,"javascript, authentication, oauth-2.0, refresh-token, vulnerability","<p>I am a little confused about the existence of refresh tokens.</p> <p>I know that refresh tokens are used to renew the access token and have a shorter lifespan.</p> <p>For instance, I wonder why ref..."
stackoverflow,77927947,Avoiding the creation of fake users in order to exploit vulnerabilities,FrogFeet,2024-02-02T20:32:27,0,0,critical,https://stackoverflow.com/questions/77927947/avoiding-the-creation-of-fake-users-in-order-to-exploit-vulnerabilities,"authentication, architecture, vulnerability","<p>Generally, after the user is created, I require email confirmation before they can log in. But this can keep users stuck without email confirmation in the database. I was thinking about adding some..."
stackoverflow,61527959,How to redirect users to their specified page after logging in?,mnunez,2020-04-30T21:44:32,0,1,high,https://stackoverflow.com/questions/61527959/how-to-redirect-users-to-their-specified-page-after-logging-in,"php, if-statement, authentication, session-variables, forms-authentication, vulnerability",<p>I've modified the login file to redirect user to their specified page. But my code simply redirect every user to the first option(rd). Users under pd department are directed to rd page. My code is ...
stackoverflow,59248783,HttpOnly vs LocalStorage to store JWT,Gabor Juhasz,2019-12-09T17:47:10,5,0,high,https://stackoverflow.com/questions/59248783/httponly-vs-localstorage-to-store-jwt,"security, authentication, cookies, jwt, single-page-application, vulnerability","<p>There are many similar questions here on SO asking about this, but couldn't find one that would address my concerns about using HttpOnly cookies.</p> <p>There are many answers that suggest using Ht..."
stackoverflow,76059053,Why are JWE tokens not more widely used than JWT tokens?,zola25,2023-04-20T03:18:44,1,0,unknown,https://stackoverflow.com/questions/76059053/why-are-jwe-tokens-not-more-widely-used-than-jwt-tokens,"authentication, security, browser, jwt, session-cookies, vulnerability",<p>I'm learning about different web authentication mechanisms such as using JWTs or session IDs to maintain a user's authentication state.</p> <p>I understand that JWT tokens don't secure any relevant...
stackoverflow,64208350,"In Django, how can the Graphene GraphQL endpoint be protected for API usage?",Moritz,2020-10-05T17:38:37,3,0,high,https://stackoverflow.com/questions/64208350/in-django-how-can-the-graphene-graphql-endpoint-be-protected-for-api-usage,"python, django, authentication, graphene-django, vulnerability","<p>Graphene provides a GraphQL integration into Django and supplies a view to create a URL endpoint. The question is how can the endpoint be protected for API usage? The <a href=""https://docs.graphene..."
stackoverflow,7064368,Security flaw with AJAX logins,PeeHaa,2011-08-15T16:54:16,3,4,unknown,https://stackoverflow.com/questions/7064368/security-flaw-with-ajax-logins,"javascript, ajax, security, authentication, security flaw",<p>Many sites nowadays use AJAX to let users login.</p> <p>However there is a (I think) huge security flaw with this design.</p> <p>If the login failed the username/password has been used in a reque...
stackoverflow,14130888,PHP &quot;Remember Me&quot; security flaw?,Scott,2013-01-03T04:58:11,12,4,unknown,https://stackoverflow.com/questions/14130888/php-remember-me-security-flaw,"php, security, authentication, remember-me, security flaw","<p>I'm in the middle of coding a 'remember me'-equipped login form, and so far the tutorials I've read (partly to make sure I'm doing it right) all say to store the encrypted password in a cookie alon..."
stackoverflow,42000143,What is the security flaw in this authentification process over unsecure HTTP?,Michael Paul,2017-02-02T16:16:54,1,2,critical,https://stackoverflow.com/questions/42000143/what-is-the-security-flaw-in-this-authentification-process-over-unsecure-http,"security, authentication, md5, sha256, security flaw","<p>First question here :)</p> <p>I've been reading many questions about how to secure login on sites without https. They are all very interesting and most answers boil down to ""Use SSL if you care ab..."
stackoverflow,2567893,SECURITY Flaws in this design for User authentication,Juba,2010-04-02T22:18:12,0,1,unknown,https://stackoverflow.com/questions/2567893/security-flaws-in-this-design-for-user-authentication,"python, authentication, pylons, security flaw","<p>SECURITY Flaws in this design for User authentication.</p> <p>From: <a href=""http://wiki.pylonshq.com/display/pylonscookbook/Simple+Homegrown+Authentication"" rel=""nofollow noreferrer"">http://wiki..."
stackoverflow,26493411,Security flaw with Firebase&#39;s Simple Email &amp; Password Login?,user3916009,2014-10-21T23:42:25,-1,1,unknown,https://stackoverflow.com/questions/26493411/security-flaw-with-firebases-simple-email-password-login,"email, authentication, firebase, firebase-security, firebasesimplelogin, security flaw","<p>Firebase's Simple Login feature includes the <a href=""https://www.firebase.com/docs/web/guide/login/password.html"" rel=""nofollow"">ability to log users in with Email &amp; Password.</a></p> <p>This..."
stackoverflow,13102543,PHP Account Security,Richard,2012-10-27T23:11:33,1,4,unknown,https://stackoverflow.com/questions/13102543/php-account-security,"php, html, security, authentication, code-injection, security flaw","<p>Currently I have a site that hides the account window where you can change password, upload files, etc. The code is simple as:<br></p> <pre><code>&lt;?php if($is_logged_in) { ?&gt; &lt;div i..."
stackoverflow,58231185,Refresh token flow : Loopback,Shivansh Jagga,2019-10-04T12:14:20,1,0,unknown,https://stackoverflow.com/questions/58231185/refresh-token-flow-loopback,"authentication, authorization, token, loopbackjs, strongloop, security flaw","<p>How to implement the refresh token flow in Loopback 3.x ?</p> <p>Some have recommended to refresh the 'created' columns of access token table, so the access token does not expire. But this results..."
stackoverflow,43755473,Authentication just by checking session,Jackyef,2017-05-03T14:26:08,1,0,unknown,https://stackoverflow.com/questions/43755473/authentication-just-by-checking-session,"php, session, authentication, cookies, security flaw","<p>Let's say I have a simple login system. Upon successful login, user_id and username will be stored in the session.</p> <p>Provided the cookie used to persist session in the client browser is encry..."
stackoverflow,55500018,"Dispatch credentials store.dispatch(new Login(userName, password))",Dirty Harry,2019-04-03T21:58:39,1,1,unknown,https://stackoverflow.com/questions/55500018/dispatch-credentials-store-dispatchnew-loginusername-password,"angular, authentication, ngrx, ngrx-effects, security flaw","<p>What is the best way of dispatching a sensitive information through ngrx-store? For example, when we dispatch a sensitive credential information like ""store.dispatch(new Login(userName, password))""..."
stackoverflow,38338879,Concrete5 5.6.3.4 User is Logged in as Wrong User,knsheely,2016-07-13T02:36:17,0,1,unknown,https://stackoverflow.com/questions/38338879/concrete5-5-6-3-4-user-is-logged-in-as-wrong-user,"hash, authentication, session-cookies, concrete5, security flaw",<p>We have had an intermittent issue with Users of our site mysteriously being logged in as a different user. The site is built on Concrete5 Version 5.6.3.4. This seems to be a huge security flaw as...
stackoverflow,47969366,Both Stackoverlfow and Google APIs require the App key to be passed as a query parameter. Why isn&#39;t this a security flaw?,Andre Pena,2017-12-25T19:38:23,3,0,unknown,https://stackoverflow.com/questions/47969366/both-stackoverlfow-and-google-apis-require-the-app-key-to-be-passed-as-a-query-p,"http, security, authentication, authorization, security flaw","<p>Most of the <strong>Google</strong> APIs (Maps/Places for instance) and <strong>Stackoverflow</strong> API (when not using OAuth, thus not impersonating a user) will require a <code>key</code> para..."
stackoverflow,44696863,Force ASPSessionID to change on login,Ankur21,2017-06-22T16:01:48,0,1,critical,https://stackoverflow.com/questions/44696863/force-aspsessionid-to-change-on-login,"asp.net, session, authentication, security flaw","<p><strong>How do I get Classic ASP to change the session ID after the user logs in?</strong></p> <p>One of our clients ran a security audit against our web site. So far, we've been able to resolve ..."
stackoverflow,76159773,"Django Login dont work, how i can i fix it?",Besart Gashi,2023-05-03T06:18:34,-1,2,unknown,https://stackoverflow.com/questions/76159773/django-login-dont-work-how-i-can-i-fix-it,"django, authentication, private, security flaw","<p>I have a functional login feature on my website, but unfortunately, the private page can still be accessed by typing in its URL, even without logging in. I am concerned about this security flaw and..."
stackoverflow,16996798,Worklight: Protected resources unexpectedly becomes Unprotected automatically,AAhad,2013-06-08T12:04:42,0,1,critical,https://stackoverflow.com/questions/16996798/worklight-protected-resources-unexpectedly-becomes-unprotected-automatically,"java, security, authentication, ibm-mobilefirst, security flaw","<p>I have protected some of my resources as per Worklight guide to protect static url, console etc.</p> <p><a href=""http://pic.dhe.ibm.com/infocenter/wrklight/v5r0m5/index.jsp?topic=/com.ibm.workligh..."
stackoverflow,59994206,Login authenticates user with any password,Awz,2020-01-31T02:13:34,0,1,unknown,https://stackoverflow.com/questions/59994206/login-authenticates-user-with-any-password,"authentication, passport.js, mean-stack, bcrypt, passport-local, security flaw","<p>I have a simple login form that I created. It seems to authenticate any existing user as long as the password field has something in it. Obviously, it is a huge security flaw. I'm new to mean stack..."
stackoverflow,20974108,PHP User Authentication through Email,Amir,2014-01-07T19:55:35,2,4,unknown,https://stackoverflow.com/questions/20974108/php-user-authentication-through-email,"php, security, authentication, hash, laravel, security flaw","<p>I'm working on a php/laravel-4 project, and we need to auto authenticate users coming from the links in the emails we send them, we need to have time limit for links so a link in email would not a..."
stackoverflow,19891405,REST API authentication - Will this be sufficient?,Pixark,2013-11-10T20:47:52,4,1,unknown,https://stackoverflow.com/questions/19891405/rest-api-authentication-will-this-be-sufficient,"rest, authentication, security flaw","<p>I have been trying to wrap my brain around authentication on a <code>REST API</code>. </p> <p>I've tried to think of a way to successfully authenticate users, keeping in mind that users can access..."
stackoverflow,1107007,Java options for web user authentication,Jerry B,2009-07-10T05:16:35,5,3,unknown,https://stackoverflow.com/questions/1107007/java-options-for-web-user-authentication,"java, security, authentication, shiro, jsecurity, security flaw","<p>I'm looking for a secure user login/session management component for a public web app. Spring Security seems to have potential, are there any other high quality alternatives? </p> <p>Conceptually..."
stackoverflow,2890744,Are there any security issues to avoid when providing a either-email-or-username-can-act-as-username login system?,Kzqai,2010-05-23T10:53:41,0,2,unknown,https://stackoverflow.com/questions/2890744/are-there-any-security-issues-to-avoid-when-providing-a-either-email-or-username,"php, security, authentication, security flaw","<p>I am in the process of moving from a ""username/password"" system to one that uses email for login. I don't think that there's any horrible problem with allowing either email or username for login, ..."
stackoverflow,16491299,OAuth2 User Credentials Grant Security,Brosa,2013-05-11T03:21:54,0,1,unknown,https://stackoverflow.com/questions/16491299/oauth2-user-credentials-grant-security,"authentication, oauth, oauth-2.0, security flaw","<p>I have a couple security questions on the OAuth 2.0 User Credential Grant type and possible security attacks. So from what I understand so far, when I exchange my users username password client ID ..."
stackoverflow,19892697,Web API authentication,Pixark,2013-11-10T22:55:29,0,1,unknown,https://stackoverflow.com/questions/19892697/web-api-authentication,"php, mysql, authentication, security flaw","<p>I have been trying to wrap my brain around authentication on an API I am to develop.</p> <p>I've tried to think of a way to successfully authenticate users, keeping in mind that users can access a..."
stackoverflow,32905696,How to avoid showing consent screen in our own native apps when external authentication?,David Ernstsson,2015-10-02T16:27:37,5,2,critical,https://stackoverflow.com/questions/32905696/how-to-avoid-showing-consent-screen-in-our-own-native-apps-when-external-authent,"android, security, authentication, oauth-2.0, openid-connect, security flaw",<h3>Background</h3> <ul> <li>We have developed a web application featuring a rest-api using oauth2/oidc and support for third party apps</li> <li>We have developed our own native apps for android and ...
stackoverflow,6712897,Is BrowserID secure?,Aaron Novstrup,2011-07-16T02:10:30,4,2,unknown,https://stackoverflow.com/questions/6712897/is-browserid-secure,"authentication, browserid, security flaw","<p>Yesterday, <a href=""http://identity.mozilla.com/post/7616727542/introducing-browserid-a-better-way-to-sign-in"" rel=""nofollow"">Mozilla announced</a> the <a href=""https://browserid.org/"" rel=""nofollo..."
stackoverflow,189623,WCF transport security with no authentication,Meidan Alon,2008-10-10T05:20:03,6,3,unknown,https://stackoverflow.com/questions/189623/wcf-transport-security-with-no-authentication,"wcf, security, authentication, security flaw",<p>Is it possible to have transport security without authentication? I'm well aware of it's flaws but atm I can't install a certificate a the client side. It seems I can set WSHttpBinding.SecurityMode...
stackoverflow,70362749,pyQGIS : How to use an URI connection with a pg_service.conf connection type in QGIS 3.16?,V Damoy,2021-12-15T16:47:59,1,1,critical,https://stackoverflow.com/questions/70362749/pyqgis-how-to-use-an-uri-connection-with-a-pg-service-conf-connection-type-in,"postgresql, authentication, uri, qgis, pyqgis, security flaw",<p>I'd like to open a postgreSQL table in QGIS 3.16 with pyGQIS.</p> <p>I've found the QgsDataSourceUri.setConnection method to do this. The problem for me is that the database password is written in ...
stackoverflow,3336636,"PHP AJAX login, is this method secure?",Phil,2010-07-26T21:34:18,5,5,unknown,https://stackoverflow.com/questions/3336636/php-ajax-login-is-this-method-secure,"php, jquery, ajax, security, authentication, security flaw","<p>I have just started PHP and mySQL and need to know if this is ""safe"". The login information is passed into the following PHP file through AJAX (jQuery).</p> <p>jQuery AJAX</p> <pre><code>$(""#logi..."
stackoverflow,49899706,Secure communication from React Landing Page with Rails Backend?,Doge,2018-04-18T17:57:12,0,2,unknown,https://stackoverflow.com/questions/49899706/secure-communication-from-react-landing-page-with-rails-backend,"ruby-on-rails, reactjs, http, authentication, security flaw","<p>I'm building a Landing Page in React where a visitor submits some data (including name and phone) and this data is sent over HTTP to a Rails 4.2 Backend.</p> <p>Now, in order for the Landing Page ..."
stackoverflow,37260393,Should I store duplicate email addresses?,tommyd456,2016-05-16T23:37:40,0,1,unknown,https://stackoverflow.com/questions/37260393/should-i-store-duplicate-email-addresses,"node.js, authentication, registration, security flaw",<p>Just thinking about my registration flow for my Nodejs/MongoDB app and wondered whether I really need to check if email addresses are already in the database when users register.</p> <p>I make my ...
stackoverflow,28458392,How can we make sure LinkedIn Javascript login is secure?,JustinHK,2015-02-11T21:11:08,4,0,unknown,https://stackoverflow.com/questions/28458392/how-can-we-make-sure-linkedin-javascript-login-is-secure,"javascript, security, authentication, authorization, linkedin-api, security flaw","<p>We've implemented the JavaScript login plugin for our site <a href=""https://developer.linkedin.com/plugins#signin"" rel=""nofollow"">using these instructions</a>, but are now running into problems ens..."
stackoverflow,32602800,Security - Generating Auth-Key for users using Base64?,thegauravmahawar,2015-09-16T13:26:37,2,2,critical,https://stackoverflow.com/questions/32602800/security-generating-auth-key-for-users-using-base64,"java, security, authentication, base64, security flaw",<p>I'm creating a website on which each new user created (that's what I'm doing for now) will have a <code>auth-key</code> generated which is in <code>Base64 encoding</code>. The <code>auth-key</code>...
stackoverflow,15819937,Django/Auth: Can request.user be exploited and point to other user?,CodeArtist,2013-04-05T00:52:59,6,2,critical,https://stackoverflow.com/questions/15819937/django-auth-can-request-user-be-exploited-and-point-to-other-user,"django, security, django-authentication, authentication, http-post, exploit","<p>Let's say i have a form that does something in database and requires user authentication that has been sent by POST, is it possible inside <em>request</em> someone evil to change the <em>user</em> ..."
stackoverflow,77927947,Avoiding the creation of fake users in order to exploit vulnerabilities,FrogFeet,2024-02-02T20:32:27,0,0,critical,https://stackoverflow.com/questions/77927947/avoiding-the-creation-of-fake-users-in-order-to-exploit-vulnerabilities,"authentication, architecture, exploit","<p>Generally, after the user is created, I require email confirmation before they can log in. But this can keep users stuck without email confirmation in the database. I was thinking about adding some..."
stackoverflow,55836757,Can Google client-id and client-secret credential be exploited by a non org member?,Alok Kumar Singh,2019-04-25T00:21:10,1,1,critical,https://stackoverflow.com/questions/55836757/can-google-client-id-and-client-secret-credential-be-exploited-by-a-non-org-memb,"security, authentication, kubernetes, google-oauth, exploit",<p>Say we have a kubernetes cluster with Google as the OIDC provider for authentication. Every developer using that cluster has the <code>~/.kube/config</code> with following configured:</p> <pre><co...
stackoverflow,74089398,How to get on a minecraft server that you are currently connected to on another computer,Tea Master,2022-10-16T23:13:04,0,1,critical,https://stackoverflow.com/questions/74089398/how-to-get-on-a-minecraft-server-that-you-are-currently-connected-to-on-another,"authentication, network-programming, minecraft, exploit","<p>Basically, if I'm connected to a minecraft server on computer A, then can I connect to the same server on computer B without server noiticing disconnecting on computer A and reconnecting on compute..."
stackoverflow,17856513,Correct use of Google+ one-time login token,Synesso,2013-07-25T16:47:55,0,1,critical,https://stackoverflow.com/questions/17856513/correct-use-of-google-one-time-login-token,"security, authentication, google-plus, exploit","<p>In the <a href=""https://github.com/googleplus/gplus-quickstart-java/blob/master/src/com/google/plus/samples/quickstart/Signin.java#L133"" rel=""nofollow"">sample Java code for Google+ server-side auth..."
stackoverflow,45285000,"How to fix wordpress login attempts. I have deleted wp-login.php, and still getting attempts?",BizZip,2017-07-24T21:22:05,0,1,critical,https://stackoverflow.com/questions/45285000/how-to-fix-wordpress-login-attempts-i-have-deleted-wp-login-php-and-still-gett,"mysql, wordpress, security, authentication, brute-force, exploit",<p>Check list of Items I have done:-</p> <ol> <li>added new salts (better security pro paid plugin = max'd out security) brute force attack is on and has not stopped all attempts.</li> <li>changed lo...
stackoverflow,45006793,How to prevent a OAuth attack (see attack scenario)?,Pavel Shikhov,2017-07-10T13:37:05,0,1,critical,https://stackoverflow.com/questions/45006793/how-to-prevent-a-oauth-attack-see-attack-scenario,"security, authentication, web, oauth, oauth-2.0, exploit",<p>Here is the attack scenario of how an attacker can takeover victim's account:</p> <ol> <li>Attacker is authenticated at provider.com</li> <li>Attacker initiates a process of authenticating with pr...
stackoverflow,31044180,Protecting twitter keys on Android,xyz,2015-06-25T13:13:57,6,2,critical,https://stackoverflow.com/questions/31044180/protecting-twitter-keys-on-android,"android, facebook, security, authentication, twitter, exploit","<p>When adding twitter authentication to my android app, going to <a href=""https://dev.twitter.com/twitter-kit/android/twitter"" rel=""nofollow"">Twitter dev</a>, I was flabbergasted at finding that I ha..."
stackoverflow,56661460,How to protect end to end services using JWT,Vishant Shah,2019-06-19T12:07:01,0,0,critical,https://stackoverflow.com/questions/56661460/how-to-protect-end-to-end-services-using-jwt,"react-native, authentication, jwt, exploit","<p>I am trying to build mobile app using react-native backed by spring boot apis and in order to implement authentication and authorisation, i researched and found JWT is a way to go.</p> <p>There ar..."
stackoverflow,32295142,Mutual SSL/TLS Authentication: Returning a certificate from iOS that Node.js will authenticate,Gene Myers,2015-08-30T15:05:43,1,0,critical,https://stackoverflow.com/questions/32295142/mutual-ssl-tls-authentication-returning-a-certificate-from-ios-that-node-js-wil,"ios, node.js, authentication, ssl, exploit","<p>I've created a proof of concept Node.js HTTPS server, with server certificates from a Trusted CA, (my-server.crt and my-server.key) and I've created my own CA for creating client certificates (ca.c..."
stackoverflow,7663439,How to determine if logged on windows account has been authenticated on domain,petrobrush,2011-10-05T20:33:32,6,2,critical,https://stackoverflow.com/questions/7663439/how-to-determine-if-logged-on-windows-account-has-been-authenticated-on-domain,"c++, windows, authentication, active-directory, single-sign-on, exploit","<blockquote> <p><strong>Possible Duplicate:</strong><br> <a href=""https://stackoverflow.com/questions/1337923/authenticating-users-using-active-directory-in-client-server-application"">Authenticati..."
stackoverflow,1088144,authentication token is encrypted but not signed - weakness?,Michael Lucas,2009-07-06T22:43:41,6,3,critical,https://stackoverflow.com/questions/1088144/authentication-token-is-encrypted-but-not-signed-weakness,"security, authentication, encryption, token, digital-signature, exploit","<p>Through the years I've come across this scenario more than once. You have a bunch of user-related data that you want to send from one application to another. The second application is expected to ""..."
stackoverflow,25393772,Web API Security and Authentication - bearer token,bugnuker,2014-08-20T03:37:02,6,2,critical,https://stackoverflow.com/questions/25393772/web-api-security-and-authentication-bearer-token,"c#, asp.net, security, authentication, exploit","<p>I am working on learning about Web API and API's methodology in general.</p> <p>At this time, I'm am investigating Authentication. </p> <p>I know there are several ways for API authentication and..."
stackoverflow,19661144,Authentication from client side on node.js,MightyMouse,2013-10-29T20:02:36,0,0,critical,https://stackoverflow.com/questions/19661144/authentication-from-client-side-on-node-js,"jquery, node.js, authentication, express, pug, exploit","<p>I am using basic authentication on node.js + express.</p> <p>The user can login with his/her credentials, and then, during the authentication phase I can store the username (as well as the passwor..."
stackoverflow,36753577,Login form sleep() with bcrypt,Saul Tigh,2016-04-21T01:08:47,2,1,critical,https://stackoverflow.com/questions/36753577/login-form-sleep-with-bcrypt,"php, security, authentication, exploit","<p>is there any point using sleep() to stop brute force attacks if passwords are stored by bcrypt with <code>password_hash($password, PASSWORD_DEFAULT)</code> and <code>['cost' =&gt; 12]</code> </p> ..."
