platform,post_id,title,author,created_date,score,comments_count,severity,url,tags,content_preview
stackoverflow,76083020,Is CryptoJS.AES ironclad by using a random 256 bit string (one time use)?,master_axe,2023-04-23T09:10:57,-1,1,unknown,https://stackoverflow.com/questions/76083020/is-cryptojs-aes-ironclad-by-using-a-random-256-bit-string-one-time-use,"node.js, encryption, aes, cryptojs, encryption-symmetric, security flaw","<p>I'd like to store a secret on my server securely, and permanently. Before storing it, I would run the following code:</p> <pre><code>import CryptoJS from 'crypto-js'; const SECRET = 'secret'; cons..."
stackoverflow,47654864,How to add a forgot password feature for the described system without compromising its security?,Mercury,2017-12-05T19:02:32,1,1,unknown,https://stackoverflow.com/questions/47654864/how-to-add-a-forgot-password-feature-for-the-described-system-without-compromisi,"security, encryption, passwords, reset-password, security flaw",<p>I created a security system that uses the users password to encrypt the users private key which is then stored on the database. So a user can only retrieve the private key if he enters the correct ...
stackoverflow,60945211,Why use JSON Web Tokens (JWT) over just normal encryption,Johann,2020-03-31T12:45:40,5,1,unknown,https://stackoverflow.com/questions/60945211/why-use-json-web-tokens-jwt-over-just-normal-encryption,"encryption, jwt, security flaw",<p>JWT is meant to allow the exchange of a token that is tamper-proof when a client needs to communicate with the backend. It also serves to avoid making calls to the backend datastore by caching sess...
stackoverflow,9797416,Custom JBoss DataSorurce password encryption?,Chepech,2012-03-21T06:55:02,3,3,critical,https://stackoverflow.com/questions/9797416/custom-jboss-datasorurce-password-encryption,"security, encryption, jboss, datasource, jboss-4.2.x, security flaw","<p>I'm working with <strong>JBoss 4.2.1GA</strong>.</p> <p>As you might now there is a way to avoid having <a href=""http://docs.jboss.org/jbosssecurity/docs/6.0/security_guide/html/Encrypting_Data_Sou..."
stackoverflow,50199158,AES Initialization Vector randomization,Muhammad Hamza,2018-05-06T16:58:23,-2,1,critical,https://stackoverflow.com/questions/50199158/aes-initialization-vector-randomization,"java, php, android, encryption, aes, security flaw",<p>I am trying to reuse an AES implementation with Initialization Vector. So far I am only implementing the part where data is being encrypted on the android application and being decrypted on the php...
stackoverflow,22900791,How to check if the user entered the password that matches the whirlpool hash?,user3483494,2014-04-07T03:58:07,0,1,unknown,https://stackoverflow.com/questions/22900791/how-to-check-if-the-user-entered-the-password-that-matches-the-whirlpool-hash,"php, encryption, hash, whirlpool, security flaw","<p>I just recently began looking into password encryption. My current code looks like this :</p> <pre><code>&lt;?php define('salt','7hPqMO(m=F+!!L6(#Yhp-CdF, &amp;Q}+cIrA;c@wcP(E--V&lt;qRmq!v*aSnM;H=..."
stackoverflow,6016992,Encryption in java - best practices?,Cheetah,2011-05-16T17:28:15,1,1,unknown,https://stackoverflow.com/questions/6016992/encryption-in-java-best-practices,"java, encryption, private-key, security flaw",<p>I am working on a client-server application in Java which is going to use <strong>private-key encryption</strong>.</p> <p>Currently I have a class with a static object of the <code>Cipher</code> c...
stackoverflow,48780283,ASPNET_REGIIS: Place AES key and IV into a KeyContainer,J Weezy,2018-02-14T11:02:48,12,1,unknown,https://stackoverflow.com/questions/48780283/aspnet-regiis-place-aes-key-and-iv-into-a-keycontainer,"c#, asp.net, encryption, cryptography, security flaw","<p>Is it possible to place an AES key and IV into a KeyContainer using ASPNET_REGIIS? If yes, how?</p> <p><strong>Context:</strong></p> <p>I have created AesProtectedConfigurationProvider to encrypt..."
stackoverflow,24396870,JAVA: AES Decryption,user1059110,2014-06-25T03:16:11,0,2,unknown,https://stackoverflow.com/questions/24396870/java-aes-decryption,"java, encryption, aes, security flaw","<p>I'm currently running into problems decrypting my data. The base64 of the encoded string is being stored in the database. So, I'm printing out the encoded string and then trying to run it back thro..."
stackoverflow,19568998,How do i decrypt a file in Android with AES?,Pontus Backlund,2013-10-24T20:09:35,3,1,unknown,https://stackoverflow.com/questions/19568998/how-do-i-decrypt-a-file-in-android-with-aes,"java, android, aes, encryption, security flaw","<p>I have a file (mp3) that i Encrypt, my intention is then to download this file to an android device and decrypt it, but during decryption i get an IOException:</p> <p><code>java.io.IOException: la..."
stackoverflow,78217630,Should I add a hash to the encrypted cookie to additionally verify the integrity of the data,user2531657,2024-03-25T13:15:02,0,0,unknown,https://stackoverflow.com/questions/78217630/should-i-add-a-hash-to-the-encrypted-cookie-to-additionally-verify-the-integrity,"php, encryption, cookies, security flaw","<p>I'm currently working on implementing cookie-based session management in my web application. Up until now, I've set up two methods to encrypt/decrypt the cookie while storing the initialization vec..."
stackoverflow,28453767,Find Encryption key from original unencrypted value and encrypted value?,user1529597,2015-02-11T17:27:04,0,0,unknown,https://stackoverflow.com/questions/28453767/find-encryption-key-from-original-unencrypted-value-and-encrypted-value,"encryption, hash, md5, sha1, security flaw","<p>i have a vendor company doing work and i noticed a flaw in the api, at one point an ID is not hashed, </p> <p>For security reasons i want to find out if at one point you can see the ID in plain te..."
stackoverflow,22947409,Is this overkill? Dynamic salt encryption for whirlpool password encryption,user3483494,2014-04-09T01:54:09,1,2,critical,https://stackoverflow.com/questions/22947409/is-this-overkill-dynamic-salt-encryption-for-whirlpool-password-encryption,"php, security, encryption, hash, whirlpool, security flaw","<p>I think I might've generated a bit of an overkill salt when it comes to password encryption in whirlpool.</p> <p>This is what the salt generation code does, step by step</p> <ol> <li><p>A pseudo-..."
stackoverflow,14916735,Using SHA1 as a message digest when generating an aes256 cbc key,zero_dev,2013-02-17T05:57:39,5,1,unknown,https://stackoverflow.com/questions/14916735/using-sha1-as-a-message-digest-when-generating-an-aes256-cbc-key,"encryption, openssl, aes, sha1, security flaw",<p>I have to do a lab for my computer security class where I am to use gpg and OpenSSL to do secure communication. I am confused about this step:</p> <pre><code>Use 'openssl enc' command line symmet...
stackoverflow,40644886,How to avoid storing usernames and passwords in plaintext?,Will,2016-11-17T06:11:32,0,0,unknown,https://stackoverflow.com/questions/40644886/how-to-avoid-storing-usernames-and-passwords-in-plaintext,"php, python, encryption, passwords, security flaw","<p>I am currently working on a project that involved interacting with third-party websites that use basic HTTP auth.</p> <p>With Python, I can use the <code>requests</code> module, along with a <code..."
stackoverflow,1664255,Strength of RSA Encrypting an AES Key,user201117,2009-11-03T04:24:30,4,4,unknown,https://stackoverflow.com/questions/1664255/strength-of-rsa-encrypting-an-aes-key,"security, encryption, cryptography, rsa, aes, security flaw","<p>I'm currently developing a system to transmit data between client and server, and was wondering what the strength of the encryption I planned to use was.</p> <p>My thought was to have a private/pu..."
stackoverflow,44391,How do I prevent replay attacks?,Josh Hinman,2008-09-04T23:53:22,18,12,unknown,https://stackoverflow.com/questions/44391/how-do-i-prevent-replay-attacks,"asp.net, security, encryption, security flaw","<p>This is related to <a href=""https://stackoverflow.com/questions/43324/can-i-put-an-aspnet-session-id-in-a-hidden-form-field"">another question I asked</a>. In summary, I have a special case of a URL..."
stackoverflow,28023255,"How to set up a minimal TLS: Configure client and server, or implement my own?",Ulrich Schuster,2015-01-19T16:39:56,0,1,unknown,https://stackoverflow.com/questions/28023255/how-to-set-up-a-minimal-tls-configure-client-and-server-or-implement-my-own,"security, ssl, encryption, https, security flaw","<p>I am looking for advice on how to best implement an M2M TLS-connection. different from ""normal"" web traffic, we control both client and server, and thus can nail down the cipher string to exactly o..."
stackoverflow,49773540,Why is metadata not encrypted?,Melanie,2018-04-11T16:39:14,0,1,unknown,https://stackoverflow.com/questions/49773540/why-is-metadata-not-encrypted,"encryption, metadata, security flaw","<p>This is a very general question. I am working on a project with my fellow students, and we are trying to create a blockchain-based communication platform. One of the flaws we found in email securi..."
stackoverflow,42752219,"Key, salt and IV when using Rijndael encryption",bdndk,2017-03-13T01:13:41,3,2,unknown,https://stackoverflow.com/questions/42752219/key-salt-and-iv-when-using-rijndael-encryption,"c#, asp.net, encryption, rijndaelmanaged, security flaw","<p>I'm working on a website, where users are able to upload files. I want to encrypt these files, in case there is some kind of security breach where access is granted to them.</p> <p>When the user w..."
stackoverflow,31851612,How are the IV and authentication tag handled for &quot;AES/GCM/NoPadding&quot;?,Michael Hixson,2015-08-06T14:44:31,58,1,critical,https://stackoverflow.com/questions/31851612/how-are-the-iv-and-authentication-tag-handled-for-aes-gcm-nopadding,"java, security, encryption, cryptography, aes-gcm, security flaw","<p>I'm using <code>AES/GCM/NoPadding</code> encryption in Java 8 and I'm wondering whether my code has a security flaw. My code seems to <em>work</em>, in that it encrypts and decrypts text, but a fe..."
stackoverflow,3577748,Encrypting text data methodology,Ross,2010-08-26T23:00:09,0,1,unknown,https://stackoverflow.com/questions/3577748/encrypting-text-data-methodology,"encryption, confidential, security flaw",<p>I'm developing a journal web app and am trying to tackle what I foresee as the biggest problem - trusting me not to read other people's entries. The solution I have so far is:</p> <ul> <li>User gi...
stackoverflow,7762489,Are Heroku dynos vulnerable to BEAST? (TLS 1.0 CBC exploit),Alec Wenzowski,2011-10-14T08:03:24,5,1,critical,https://stackoverflow.com/questions/7762489/are-heroku-dynos-vulnerable-to-beast-tls-1-0-cbc-exploit,"security, ssl, encryption, heroku, exploit","<p>Was reading <a href=""http://www.theregister.co.uk/2011/09/19/beast_exploits_paypal_ssl/"" rel=""nofollow noreferrer"">an article in The Register about BEAST</a> which lead me to the SO post about <a h..."
stackoverflow,1221959,"Can I exploit GPU to do AES encryption from .NET? If so, how?",Cheeso,2009-08-03T17:34:57,7,4,critical,https://stackoverflow.com/questions/1221959/can-i-exploit-gpu-to-do-aes-encryption-from-net-if-so-how,".net, opengl, encryption, aes, gpu, exploit","<p>Interesting paper from Trinity College of Dublin:<br> <a href=""https://www.cs.tcd.ie/~harrisoo/publications/AES_On_GPU.pdf"" rel=""noreferrer"">AES Encryption Implementation and Analysis on Commodity ..."
stackoverflow,5133811,Exploiting hash function in python,KaiserJohaan,2011-02-27T20:15:01,0,1,critical,https://stackoverflow.com/questions/5133811/exploiting-hash-function-in-python,"python, string, cookies, encryption, hash, exploit","<p>I made a topic about the built-in python hash function: <a href=""https://stackoverflow.com/questions/5128990/old-python-hashing-done-left-to-right-why-is-it-bad"">Old python hashing done left to rig..."
stackoverflow,36642320,How can I use C# to get response from Java soap1.1 service using X509 certification and encryption?,Abdeljalil Elyasni,2016-04-15T14:13:39,2,0,critical,https://stackoverflow.com/questions/36642320/how-can-i-use-c-to-get-response-from-java-soap1-1-service-using-x509-certificat,"java, c#, web-services, encryption, x509certificate, exploit",<p>We have a C# .NET 4.5 framework application that exploit soap1.1 Java web service using 3DES-CBC with RSA 1.5 padding encryption algorithm and security standard web service: </p> <pre><code>Wssp1....
stackoverflow,16160273,Random Number Seed Generator: Using System On Time,user1257724,2013-04-23T08:42:14,1,3,critical,https://stackoverflow.com/questions/16160273/random-number-seed-generator-using-system-on-time,"c, security, encryption, random, rsa, exploit","<p>I'm trying to understand why this code is a security flaw. From my understanding, it is not safe to generate a random number seed using the system time when the program is turned on, but how is tha..."
stackoverflow,26451831,How to modify the supported ciphers in yaws.conf to protect against poodlebleed,Bill Ott,2014-10-19T20:32:34,1,1,critical,https://stackoverflow.com/questions/26451831/how-to-modify-the-supported-ciphers-in-yaws-conf-to-protect-against-poodlebleed,"encryption, yaws, exploit",<p>My yaws server is exposed to the poodlebleed exploit and I want to modify the supported ciphers to reduce or eliminate the risk. I have tried numerous combinations of cipher strings based on the ci...
stackoverflow,9625844,Passing key material to openssl commands,Travis Jensen,2012-03-09T03:41:10,4,3,critical,https://stackoverflow.com/questions/9625844/passing-key-material-to-openssl-commands,"linux, security, encryption, openssl, exploit","<p>Is it safe to pass a key to the openssl command via the command line parameters in Linux? I know it nulls out the actual parameter, so it can't be viewed via /proc, but, even with that, is there so..."
stackoverflow,49903161,How does Signal app prevent QRLjacking when linking desktop to mobile?,Oleg Dulin,2018-04-18T20:36:49,0,0,critical,https://stackoverflow.com/questions/49903161/how-does-signal-app-prevent-qrljacking-when-linking-desktop-to-mobile,"security, encryption, privacy, exploit",<p>I am trying to implement linking of the desktop app to the mobile counterpart for my project. The assumption is that the mobile app is secure and the desktop app simply needs to link the session to...
stackoverflow,17893164,"Encrypt a string twice... Good, Bad or Ugly?",hjavaher,2013-07-27T06:19:47,2,2,critical,https://stackoverflow.com/questions/17893164/encrypt-a-string-twice-good-bad-or-ugly,"c#, encryption, rijndael, exploit","<p>I'm working on an encryption class that is using Rijndael algorithm (C#, ASP.Net 4.5), and out of curiosity I was wondering how beneficial would it be to encrypt the string twice. I mean Encrypt th..."
stackoverflow,26752098,In what ways is this XOR encryption system vulnerable?,Noah,2014-11-05T13:23:09,1,3,critical,https://stackoverflow.com/questions/26752098/in-what-ways-is-this-xor-encryption-system-vulnerable,"security, encryption, xor, password-encryption, exploit",<p>I am looking into simple ways to secure the many passwords I have for my online accounts. After some thought I came up with this idea:</p> <ol> <li>Change all my current passwords to be random str...
stackoverflow,7665935,"PCI - Store Cryptographic Keys Securely, Requirement 3.4",Chris Moschini,2011-10-06T00:01:03,1,0,critical,https://stackoverflow.com/questions/7665935/pci-store-cryptographic-keys-securely-requirement-3-4,"encryption, e-commerce, pci-dss, pci-compliance, exploit","<p>From the PCI DSS2 docs: <a href=""https://www.pcisecuritystandards.org/documents/pci_dss_v2.pdf"" rel=""nofollow"">https://www.pcisecuritystandards.org/documents/pci_dss_v2.pdf</a></p> <p>3.4.1.b Veri..."
stackoverflow,43881870,How to encrypt a lua script and have it be able to run with a LuaJIT executor,AdministratorReece,2017-05-10T06:09:40,0,1,critical,https://stackoverflow.com/questions/43881870/how-to-encrypt-a-lua-script-and-have-it-be-able-to-run-with-a-luajit-executor,"encryption, lua, luajit, roblox, exploit",<p>I want to make a protected Lua script [for a game] that can be run via an external program. This means I don't want anyone else to see the source code. The external program is a Lua wrapper</p> <b...
stackoverflow,10049991,How do I authenticate a login on two different servers?,Ally,2012-04-07T04:01:52,0,1,critical,https://stackoverflow.com/questions/10049991/how-do-i-authenticate-a-login-on-two-different-servers,"php, security, encryption, xss, exploit","<p>I've developed a CMS app, that stores all the client's files on their server but does the processing on mine (i.e. keeping hold of the valuable code I developed, while not allowing user submitted c..."
stackoverflow,58990041,How to decrypt Cisco Passwords type 7 using Python?,5x shanks,2019-11-22T13:41:56,1,1,critical,https://stackoverflow.com/questions/58990041/how-to-decrypt-cisco-passwords-type-7-using-python,"python, encryption, cisco, exploit","<p>I'm trying to crack some cisco type 7 passwords, and so far, I did good realising the decryption algorithm described in the following exploit: <a href=""http://pen-testing.sans.org/resources/papers/..."
stackoverflow,1088144,authentication token is encrypted but not signed - weakness?,Michael Lucas,2009-07-06T22:43:41,6,3,critical,https://stackoverflow.com/questions/1088144/authentication-token-is-encrypted-but-not-signed-weakness,"security, authentication, encryption, token, digital-signature, exploit","<p>Through the years I've come across this scenario more than once. You have a bunch of user-related data that you want to send from one application to another. The second application is expected to ""..."
stackoverflow,32448176,"Encrypting a string in Unity3D C#, sending via HTTP GET request as a URL parameter, decrypting in node.js server",techniponi,2015-09-08T07:30:27,3,0,critical,https://stackoverflow.com/questions/32448176/encrypting-a-string-in-unity3d-c-sending-via-http-get-request-as-a-url-paramet,"javascript, c#, node.js, encryption, unity-game-engine, exploit","<p>I am using a very bubblegum-and-duct-tape solution for handling an online leaderboard for a small arcade-style game in Unity WebGL. Currently, the game client sends an HTTP GET request with two par..."
stackoverflow,23732575,How to block the reversing of an encrypted string?,AStopher,2014-05-19T13:32:54,-1,2,critical,https://stackoverflow.com/questions/23732575/how-to-block-the-reversing-of-an-encrypted-string,"c++, mysql, encryption, exploit","<p><em>I have no idea if this question is suitable for SO, but I posted it anyway because I'm curious to see if there are any concrete solutions to this.</em></p> <p>I am using the MySQL Connector wi..."
stackoverflow,1319463,Encrypt resources in Cocoa app?,indragie,2009-08-24T01:55:23,0,4,critical,https://stackoverflow.com/questions/1319463/encrypt-resources-in-cocoa-app,"objective-c, cocoa, encryption, shell, exploit","<p>I have a shell script stored in the resources folder of my Cocoa app. If used improperly it could be dangerous (even though I have taken precautions to reduce exploits, such as using the absolute p..."
stackoverflow,52203330,Is there a generic method to find out if network data is sent encrypted?,moccajoghurt,2018-09-06T17:13:01,1,0,unknown,https://stackoverflow.com/questions/52203330/is-there-a-generic-method-to-find-out-if-network-data-is-sent-encrypted,"security, winapi, encryption, network-programming, exploit, exploit",<p>I am working on a penetration testing framework for computer games that will detect potential security vulnerabilities. Part of the automated testing will be to verify that the network data is sent...
stackoverflow,449497,MMORPG protocol encryption,Zombies,2009-01-16T09:45:11,9,7,critical,https://stackoverflow.com/questions/449497/mmorpg-protocol-encryption,"encryption, client-server, bots, exploit",<p>Anyone know what the trend is with MMORPG developers encryption their client/server protocols these days?</p> <p>The pro's and con's are as follows.</p> <p>Encrypting protocol:</p> <ul> <li>prot...
stackoverflow,5439919,Example of simple flawed hashing algorithm vulnerable to preimaging attacks,John,2011-03-26T07:38:34,1,2,critical,https://stackoverflow.com/questions/5439919/example-of-simple-flawed-hashing-algorithm-vulnerable-to-preimaging-attacks,"algorithm, encryption, hash, exploit","<p>I am looking for an example of a simple hashing algorithm that can be shown to be vulnerable to multiple preimage attacks for a specified input length. </p> <p>For example, if I know that the inpu..."
stackoverflow,54369175,How to encrypt data using BLE connection using Bluez5.50,AV28,2019-01-25T21:53:34,2,1,critical,https://stackoverflow.com/questions/54369175/how-to-encrypt-data-using-ble-connection-using-bluez5-50,"c++, security, encryption, bluetooth-lowenergy, bluez, exploit","<p>I'm working on a C++ project that deals with data transmission. My system is composed of two different devices, that have to exchange sensitive data in a trusted mode. To do this I downloaded and s..."
stackoverflow,77382388,How to Secure .NET Named Pipe Communication From DLL Injection on the Client Side?,Abdur Rahman ,2023-10-29T13:15:14,1,1,critical,https://stackoverflow.com/questions/77382388/how-to-secure-net-named-pipe-communication-from-dll-injection-on-the-client-sid,"c#, security, encryption, named-pipes, access-rights, exploit","<p>Our .NET Framework C# application has two parts, a client (unelevated) and a service (elevated). The communication between the client and the service takes place over the named pipe. The client (na..."
stackoverflow,44697163,Change the encryption algorithm of IPsec to Null on UE,Android,2017-06-22T16:16:11,0,1,critical,https://stackoverflow.com/questions/44697163/change-the-encryption-algorithm-of-ipsec-to-null-on-ue,"android, encryption, sip, voip, ipsec, exploit",<p>We are performing network analysis using UE ( rooted Android phone). We have no problems getting information from Pcap one of the providers who use SIP without IPsec encryption. However the respons...
stackoverflow,12904560,Safely storing encrypted credentials in django,askvictor,2012-10-16T03:19:09,14,3,critical,https://stackoverflow.com/questions/12904560/safely-storing-encrypted-credentials-in-django,"python, django, security, encryption, credentials, exploit","<p>I'm working on a python/django app which, among other things, syncs data to a variety of other services, including samba shares, ssh(scp) servers, Google apps, and others. As such, it needs to stor..."
stackoverflow,68165501,How can I configure puma to only allow strong TLS ciphers?,Mark,2021-06-28T20:20:14,2,1,critical,https://stackoverflow.com/questions/68165501/how-can-i-configure-puma-to-only-allow-strong-tls-ciphers,"ruby-on-rails, encryption, puma, puma-dev, exploit","<p>I have a Ruby on Rails application that runs under <a href=""https://github.com/puma/puma/tree/v4.3.8"" rel=""nofollow noreferrer"">puma v4.3.8</a>. It currently allows a number of weaker TLS ciphers. ..."
stackoverflow,16009731,HTTPS key negotiation and tunneling over HTTP using Javascript,ose,2013-04-15T12:52:00,0,1,critical,https://stackoverflow.com/questions/16009731/https-key-negotiation-and-tunneling-over-http-using-javascript,"encryption, security, protocols, tunneling, exploit","<p>HTTPS is widely used for security online. It offers security and integrity, but not authentication. To ensure the client is not talking to a man-in-the-middle, we have digital certificates and the ..."
stackoverflow,68441968,i need to encrypt files using a variant of Vernam Cipher in C language. Could you inspect my code?,Somakun,2021-07-19T19:42:07,1,1,critical,https://stackoverflow.com/questions/68441968/i-need-to-encrypt-files-using-a-variant-of-vernam-cipher-in-c-language-could-yo,"c, algorithm, encryption, exploit",<p>i'm coding this program that allows you to encrypt files using vernam cipher in C language. i would be glad if you could inspect my code and tell me if i can make some improvements to it or if ther...
stackoverflow,73840657,Reduce AES-CTR malleability impact by shuffling plain text,Callimard,2022-09-25T02:51:00,0,0,critical,https://stackoverflow.com/questions/73840657/reduce-aes-ctr-malleability-impact-by-shuffling-plain-text,"java, encryption, aes, exploit",<p>I need to cipher and decipher text with randomly access. For this I decided to use AES in CTR mode which is a good compromise between CBC and GCM.</p> <p><strong>But CTR mode is malleable</strong>....
stackoverflow,15618060,A licensing system for my (WinForms) application. Would this be secure enough? (Within reason),SolaGratia,2013-03-25T20:28:10,-1,4,critical,https://stackoverflow.com/questions/15618060/a-licensing-system-for-my-winforms-application-would-this-be-secure-enough,"vb.net, security, encryption, licensing, copy-protection, exploit","<p>I have researched on each element or system that I am willing to implement into a generic software licensing system for my soon-to-be apps (irrelevant, as this should work, or be usable on all of m..."
stackoverflow,60174,How can I prevent SQL injection in PHP?,Andrew G. Johnson,2008-09-13T05:25:00,2769,27,high,https://stackoverflow.com/questions/60174/how-can-i-prevent-sql-injection-in-php,"php, mysql, sql, security, sql-injection, vulnerability","<p>If user input is inserted without modification into an SQL query, then the application becomes vulnerable to <a href=""https://stackoverflow.com/a/332367/"">SQL injection</a>, like in the following e..."
