platform,post_id,title,author,score,severity,url,created_date
reddit,1l43aqc,Vulnerabilities in Anthropic’s MCP: Full-Schema Poisoning + Secret-Leaking Tool Attacks (PoC Inside),jat0369,45,unknown,https://reddit.com/r/netsec/comments/1l43aqc/vulnerabilities_in_anthropics_mcp_fullschema/,2025-06-05T21:45:22
reddit,1l1fh52,Vulnerabilities Found in Preinstalled apps on Android Smartphones could perform factory reset of dev,barakadua131,82,unknown,https://reddit.com/r/netsec/comments/1l1fh52/vulnerabilities_found_in_preinstalled_apps_on/,2025-06-02T16:52:10
reddit,1ldiilv,Security Analysis: MCP Protocol Vulnerabilities in AI Toolchains,ES_CY,14,unknown,https://reddit.com/r/netsec/comments/1ldiilv/security_analysis_mcp_protocol_vulnerabilities_in/,2025-06-17T14:46:26
reddit,1l39v5s,"Multiple CVEs in Infoblox NetMRI: RCE, Auth Bypass, SQLi, and File Read Vulnerabilities",hackers_and_builders,26,unknown,https://reddit.com/r/netsec/comments/1l39v5s/multiple_cves_in_infoblox_netmri_rce_auth_bypass/,2025-06-04T21:52:01
reddit,1l7vrmd,New ISPConfig Authenticated Remote Code Execution Vulnerability,SSDisclosure,4,unknown,https://reddit.com/r/netsec/comments/1l7vrmd/new_ispconfig_authenticated_remote_code_execution/,2025-06-10T16:28:57
reddit,1l9pblf,Millions of Vulnerabilities: One Checklist to Kill The Noise,pathetiq,7,unknown,https://reddit.com/r/netsec/comments/1l9pblf/millions_of_vulnerabilities_one_checklist_to_kill/,2025-06-12T20:56:51
reddit,1lf40wc,Sleepless Strings - Template Injection in Insomnia,_pimps,21,unknown,https://reddit.com/r/netsec/comments/1lf40wc/sleepless_strings_template_injection_in_insomnia/,2025-06-19T12:14:13
reddit,1l858l1,Code execution from web browser using URL schemes handled by KDE's KTelnetService and Konsole (CVE-2,11d_space,13,unknown,https://reddit.com/r/netsec/comments/1l858l1/code_execution_from_web_browser_using_url_schemes/,2025-06-10T23:16:20
reddit,1kz0nci,Finding SSRFs in Azure DevOps - Part 2,BinarySecurity,15,unknown,https://reddit.com/r/netsec/comments/1kz0nci/finding_ssrfs_in_azure_devops_part_2/,2025-05-30T15:48:08
reddit,1l86ylf,Research On Developing Secure AI Agents Using Google's A2A Protocol,Artistic_Bee_2117,0,unknown,https://reddit.com/r/netsec/comments/1l86ylf/research_on_developing_secure_ai_agents_using/,2025-06-11T00:21:40
reddit,1le0n3j,Wallet apps aren’t safe either — here’s how attackers exploit their flawed security models,alexlash,28,unknown,https://reddit.com/r/netsec/comments/1le0n3j/wallet_apps_arent_safe_either_heres_how_attackers/,2025-06-18T03:48:22
reddit,1lbcbap,GIMP Heap Overflow Re-Discovery and Exploitation (CVE-2025–6035),cy1337,33,unknown,https://reddit.com/r/netsec/comments/1lbcbap/gimp_heap_overflow_rediscovery_and_exploitation/,2025-06-14T21:39:52
reddit,1kwhjaz,GitHub MCP Exploited: Accessing private repositories via MCP,Proofix,27,unknown,https://reddit.com/r/netsec/comments/1kwhjaz/github_mcp_exploited_accessing_private/,2025-05-27T13:18:25
reddit,1kwm9sq,The Single-Packet Shovel: Digging for Desync-Powered Request Tunnelling,t0xodile,12,unknown,https://reddit.com/r/netsec/comments/1kwm9sq/the_singlepacket_shovel_digging_for_desyncpowered/,2025-05-27T18:12:26
reddit,1l4am2x,DroidGround: Elevate your Android CTF Challenges,deleee,18,unknown,https://reddit.com/r/netsec/comments/1l4am2x/droidground_elevate_your_android_ctf_challenges/,2025-06-06T02:35:26
reddit,1kuuvzz,BadUSB Attack Explained: From Principles to Practice and Defense,repoog,30,unknown,https://reddit.com/r/netsec/comments/1kuuvzz/badusb_attack_explained_from_principles_to/,2025-05-25T10:48:20
reddit,1l8n3r0,CVE-2025-33073: A Look in the Mirror - The Reflective Kerberos Relay Attack,RedTeamPentesting,28,unknown,https://reddit.com/r/netsec/comments/1l8n3r0/cve202533073_a_look_in_the_mirror_the_reflective/,2025-06-11T13:40:16
reddit,1ldpnx4,"CVE-2025-34508: Another File Sharing Application, Another Path Traversal",dinobyt3s,15,unknown,https://reddit.com/r/netsec/comments/1ldpnx4/cve202534508_another_file_sharing_application/,2025-06-17T20:40:26
reddit,1lbcbap,GIMP Heap Overflow Re-Discovery and Exploitation (CVE-2025–6035),cy1337,32,unknown,https://reddit.com/r/netsec/comments/1lbcbap/gimp_heap_overflow_rediscovery_and_exploitation/,2025-06-14T21:39:52
reddit,1l7z99n,CVE-2025-47934 - Spoofing OpenPGP.js signature verification,ThomasRinsma,27,unknown,https://reddit.com/r/netsec/comments/1l7z99n/cve202547934_spoofing_openpgpjs_signature/,2025-06-10T19:21:02
reddit,1kxcit3,Remote Code Execution on Evertz SDVN (CVE-2025-4009 - Full Disclosure),g_e_r_h_a_r_d,18,unknown,https://reddit.com/r/netsec/comments/1kxcit3/remote_code_execution_on_evertz_sdvn_cve20254009/,2025-05-28T14:42:46
reddit,1l858l1,Code execution from web browser using URL schemes handled by KDE's KTelnetService and Konsole (CVE-2,11d_space,13,unknown,https://reddit.com/r/netsec/comments/1l858l1/code_execution_from_web_browser_using_url_schemes/,2025-06-10T23:16:20
reddit,1kvtr2i,Unauthenticated RCE on Smartbedded MeteoBridge (CVE-2025-4008),g_e_r_h_a_r_d,0,unknown,https://reddit.com/r/netsec/comments/1kvtr2i/unauthenticated_rce_on_smartbedded_meteobridge/,2025-05-26T18:30:15
reddit,1ky7bng,Deguard: turning a T480 into a coreboot laptop (10-min talk + live demo),3mdeb,29,unknown,https://reddit.com/r/netsec/comments/1ky7bng/deguard_turning_a_t480_into_a_coreboot_laptop/,2025-05-29T15:55:23
reddit,1lh9lw5,Series 2: Implementing the WPA in RAWPA - Part 2,Dark-stash,12,unknown,https://reddit.com/r/netsec/comments/1lh9lw5/series_2_implementing_the_wpa_in_rawpa_part_2/,2025-06-22T04:47:56
reddit,1l6fkox,What are some big recent vulnerabilities you think people should be aware of?,KingKilo9,83,unknown,https://reddit.com/r/cybersecurity/comments/1l6fkox/what_are_some_big_recent_vulnerabilities_you/,2025-06-08T21:29:00
reddit,1l1wq9b,Automating Vulnerability Management,Pure_Substance_2905,58,unknown,https://reddit.com/r/cybersecurity/comments/1l1wq9b/automating_vulnerability_management/,2025-06-03T04:43:36
reddit,1kwntqq,Vulnerabilities found in NASA’s open source software,tekz,212,unknown,https://reddit.com/r/cybersecurity/comments/1kwntqq/vulnerabilities_found_in_nasas_open_source/,2025-05-27T19:22:44
reddit,1kvp3v1,"Vulnerability management for ISO 27001, how do you keep up?",Sharp_Beat6461,77,unknown,https://reddit.com/r/cybersecurity/comments/1kvp3v1/vulnerability_management_for_iso_27001_how_do_you/,2025-05-26T13:43:43
reddit,1lej5z5,Vulnerability management in Defender - I'm overwhelmed and need some guidance!,Infamous_Fun286,23,unknown,https://reddit.com/r/cybersecurity/comments/1lej5z5/vulnerability_management_in_defender_im/,2025-06-18T20:23:41
reddit,1l72v4d,Vulnerability scanning architecture,fourier_floop,17,unknown,https://reddit.com/r/cybersecurity/comments/1l72v4d/vulnerability_scanning_architecture/,2025-06-09T17:26:53
reddit,1l7yvr9,Are there really any real life incidents that are due to container vulnerabilities being exploited?,ConstructionSome9015,43,unknown,https://reddit.com/r/cybersecurity/comments/1l7yvr9/are_there_really_any_real_life_incidents_that_are/,2025-06-10T19:04:38
reddit,1l1dsd7,Vulnerabilities Found in Preinstalled apps on Android Smartphones could perform factory reset of dev,barakadua131,183,unknown,https://reddit.com/r/cybersecurity/comments/1l1dsd7/vulnerabilities_found_in_preinstalled_apps_on/,2025-06-02T15:11:13
reddit,1kw9spd,How to deal with Curl vulnerabilities in Microsoft products,Ok_Dragonfruit_3379,26,unknown,https://reddit.com/r/cybersecurity/comments/1kw9spd/how_to_deal_with_curl_vulnerabilities_in/,2025-05-27T05:49:26
reddit,1leiovm,How do I responsibly report a serious security vulnerability in my car if the company has no public ,tom_xploit,30,unknown,https://reddit.com/r/cybersecurity/comments/1leiovm/how_do_i_responsibly_report_a_serious_security/,2025-06-18T20:04:32
reddit,1l97ete,Critical Apple Vulnerability Chain— Help,No_Introduction4106,0,unknown,https://reddit.com/r/cybersecurity/comments/1l97ete/critical_apple_vulnerability_chain_help/,2025-06-12T04:52:46
reddit,1ktudwc,"[Open Source Release] OpenVulnScan – A Lightweight, Agent + Nmap + ZAP-Powered Vulnerability Scanner",sudophantom,55,unknown,https://reddit.com/r/cybersecurity/comments/1ktudwc/open_source_release_openvulnscan_a_lightweight/,2025-05-24T02:27:54
reddit,1lbbt9j,Contribute Security Rules to Stop Cursor from Writing Vulnerable Code,LordKittyPanther,7,unknown,https://reddit.com/r/cybersecurity/comments/1lbbt9j/contribute_security_rules_to_stop_cursor_from/,2025-06-14T21:17:59
reddit,1kxvery,Penetration Test Report: U.S. Constitutional and Institutional Vulnerabilities (thought experiment: ,Guava7,0,unknown,https://reddit.com/r/cybersecurity/comments/1kxvery/penetration_test_report_us_constitutional_and/,2025-05-29T04:36:13
reddit,1l9pa0r,Millions of Vulnerabilities: One Checklist to Kill The Noise,pathetiq,3,unknown,https://reddit.com/r/cybersecurity/comments/1l9pa0r/millions_of_vulnerabilities_one_checklist_to_kill/,2025-06-12T20:55:09
reddit,1ld3apg,Is there any API or open-source project that publishes new vulnerabilities with remediation details?,Personal-Work4649,3,unknown,https://reddit.com/r/cybersecurity/comments/1ld3apg/is_there_any_api_or_opensource_project_that/,2025-06-17T01:40:30
reddit,1l3tnfx,"Serious bug on OneDrive, vulnerability exposes user data to security risks",davideownzall,21,unknown,https://reddit.com/r/cybersecurity/comments/1l3tnfx/serious_bug_on_onedrive_vulnerability_exposes/,2025-06-05T13:33:25
reddit,1ktlrce,Origin of having vulnerability registers,FaallenOon,7,unknown,https://reddit.com/r/cybersecurity/comments/1ktlrce/origin_of_having_vulnerability_registers/,2025-05-23T20:31:25
reddit,1le0pvb,Interesting breakdown of vulnerabilities in mobile wallet apps,alexlash,8,unknown,https://reddit.com/r/cybersecurity/comments/1le0pvb/interesting_breakdown_of_vulnerabilities_in/,2025-06-18T03:51:38
reddit,1ldid2g,Vulnerabilities in using MCP,ES_CY,3,unknown,https://reddit.com/r/cybersecurity/comments/1ldid2g/vulnerabilities_in_using_mcp/,2025-06-17T14:36:03
reddit,1l7yvr9,Are there really any real life incidents that are due to container vulnerabilities being exploited?,ConstructionSome9015,40,unknown,https://reddit.com/r/cybersecurity/comments/1l7yvr9/are_there_really_any_real_life_incidents_that_are/,2025-06-10T19:04:38
reddit,1l851rw,0 day exploit and black market?,ResearchSuccessful87,0,unknown,https://reddit.com/r/cybersecurity/comments/1l851rw/0_day_exploit_and_black_market/,2025-06-10T23:09:06
reddit,1le2f11,"For people who have discovered zero day exploits being publicly exploited, how?",Professional-Dork26,48,unknown,https://reddit.com/r/cybersecurity/comments/1le2f11/for_people_who_have_discovered_zero_day_exploits/,2025-06-18T05:07:11
reddit,1l50efg,How dangerous is someone with offensive securities 401 advanced windows exploitation,AmountInformal4013,0,unknown,https://reddit.com/r/cybersecurity/comments/1l50efg/how_dangerous_is_someone_with_offensive/,2025-06-07T00:25:58
reddit,1lfonsb,What are the recent most common security exploits?,MrWayneGrayson,0,unknown,https://reddit.com/r/cybersecurity/comments/1lfonsb/what_are_the_recent_most_common_security_exploits/,2025-06-20T04:30:20
reddit,1kx4rd9,GitHub MCP Exploited: Accessing private repositories via MCP,Party_Wolf6604,25,unknown,https://reddit.com/r/cybersecurity/comments/1kx4rd9/github_mcp_exploited_accessing_private/,2025-05-28T07:02:52
reddit,1l2z55i,Cybersecurity Lab: How to Use SEToolkit for Phishing Attacks (WebJacking Exploit),Dark-Marc,10,unknown,https://reddit.com/r/cybersecurity/comments/1l2z55i/cybersecurity_lab_how_to_use_setoolkit_for/,2025-06-04T12:38:08
reddit,1l5ca18,Cybersecurity Lab Exercise: How to Use SEToolkit for Phishing Attacks (WebJacking Exploit),Dark-Marc,30,unknown,https://reddit.com/r/cybersecurity/comments/1l5ca18/cybersecurity_lab_exercise_how_to_use_setoolkit/,2025-06-07T09:56:21
reddit,1le5rti,SQLMap Tool: Identify and Exploit SQL Injection Vulnerabilities (Lab Exercise),Dark-Marc,12,unknown,https://reddit.com/r/cybersecurity/comments/1le5rti/sqlmap_tool_identify_and_exploit_sql_injection/,2025-06-18T07:52:16
reddit,1l9js7z,Two Distinct Botnets Exploit Wazuh Server Vulnerability to Launch Mirai-Based Attacks,2hau,2,unknown,https://reddit.com/r/cybersecurity/comments/1l9js7z/two_distinct_botnets_exploit_wazuh_server/,2025-06-12T16:42:52
reddit,1la2zjj,Ransomware Actors Exploit Unpatched SimpleHelp Remote Monitoring and Management to Compromise Utilit,Hassan1990A,4,unknown,https://reddit.com/r/cybersecurity/comments/1la2zjj/ransomware_actors_exploit_unpatched_simplehelp/,2025-06-13T06:22:44
reddit,1kyyaco,"Threat actors are leveraging Google Apps Script to conduct evasive phishing campaigns, exploiting it",Novel_Negotiation224,21,unknown,https://reddit.com/r/cybersecurity/comments/1kyyaco/threat_actors_are_leveraging_google_apps_script/,2025-05-30T13:06:42
reddit,1l300dc,🔒 Update Chrome Today! – New 0-day Vulnerability (CVE-2025-5419) Is Being Exploited in the Wild,ObjectiveTreacle4548,3,unknown,https://reddit.com/r/cybersecurity/comments/1l300dc/update_chrome_today_new_0day_vulnerability/,2025-06-04T13:38:07
reddit,1l0r9v9,cyberattacks nightmare,Better_Video_702,362,unknown,https://reddit.com/r/cybersecurity/comments/1l0r9v9/cyberattacks_nightmare/,2025-06-01T20:41:02
reddit,1kyabsi,"9,000 Asus routers compromised by botnet attack and persistent SSH backdoor that even firmware updat",EwMelanin,788,unknown,https://reddit.com/r/cybersecurity/comments/1kyabsi/9000_asus_routers_compromised_by_botnet_attack/,2025-05-29T18:36:46
reddit,1l6f2hs,What would be your ideal side income?,droxia,213,unknown,https://reddit.com/r/cybersecurity/comments/1l6f2hs/what_would_be_your_ideal_side_income/,2025-06-08T21:07:04
reddit,1kxe2az,The Ultimate Active Directory Cheat Sheet,Such-Phase-6406,384,unknown,https://reddit.com/r/cybersecurity/comments/1kxe2az/the_ultimate_active_directory_cheat_sheet/,2025-05-28T16:24:23
reddit,1ledho9,Is this normal: A botnet (I assume) using 1+ million unique IP addresses seems to crawl our website?,QuarantineCoder,99,unknown,https://reddit.com/r/cybersecurity/comments/1ledho9/is_this_normal_a_botnet_i_assume_using_1_million/,2025-06-18T15:48:55
reddit,1kyvw52,What skills do you wish you had learned more for your career?,cojode6,16,unknown,https://reddit.com/r/cybersecurity/comments/1kyvw52/what_skills_do_you_wish_you_had_learned_more_for/,2025-05-30T10:29:58
reddit,1l9jfoh,I found lots of sensitive information in ghost git commits,0xMeteor,59,unknown,https://reddit.com/r/cybersecurity/comments/1l9jfoh/i_found_lots_of_sensitive_information_in_ghost/,2025-06-12T16:22:34
reddit,1ktudwc,"[Open Source Release] OpenVulnScan – A Lightweight, Agent + Nmap + ZAP-Powered Vulnerability Scanner",sudophantom,53,unknown,https://reddit.com/r/cybersecurity/comments/1ktudwc/open_source_release_openvulnscan_a_lightweight/,2025-05-24T02:27:54
reddit,1kte42l,Free cve API/DB,Dismal-Grand7869,6,unknown,https://reddit.com/r/cybersecurity/comments/1kte42l/free_cve_apidb/,2025-05-23T13:34:56
reddit,1kuebv8,Looking for LLM for CVE mapping,Pepposo98,0,unknown,https://reddit.com/r/cybersecurity/comments/1kuebv8/looking_for_llm_for_cve_mapping/,2025-05-24T21:01:55
reddit,1l8n9p0,CVE-2025-33073: A Look in the Mirror - The Reflective Kerberos Relay Attack,RedTeamPentesting,8,unknown,https://reddit.com/r/cybersecurity/comments/1l8n9p0/cve202533073_a_look_in_the_mirror_the_reflective/,2025-06-11T13:51:58
reddit,1ldt42b,Critical Teleport Auth Bypass (CVE-2025-49825) – Some Resources,-Devlin-,15,unknown,https://reddit.com/r/cybersecurity/comments/1ldt42b/critical_teleport_auth_bypass_cve202549825_some/,2025-06-17T22:51:51
reddit,1le3qra,"CVE-2025-34508: Another File Sharing Application, Another Path Traversal",Expert-Dragonfly-715,3,unknown,https://reddit.com/r/cybersecurity/comments/1le3qra/cve202534508_another_file_sharing_application/,2025-06-18T06:10:09
reddit,1ldqzus,"Déjà vu: Critical CVSS 9.9, Veeam Backup &amp; Replication vulnerability for domain joined backup se",PlannedObsolescence_,1,unknown,https://reddit.com/r/cybersecurity/comments/1ldqzus/déjà_vu_critical_cvss_99_veeam_backup_replication/,2025-06-17T21:31:47
reddit,1l300dc,🔒 Update Chrome Today! – New 0-day Vulnerability (CVE-2025-5419) Is Being Exploited in the Wild,ObjectiveTreacle4548,2,unknown,https://reddit.com/r/cybersecurity/comments/1l300dc/update_chrome_today_new_0day_vulnerability/,2025-06-04T13:38:07
reddit,1kvvvza,Zero-Click Agent Hijacking in LLM Browsing Frameworks (CVE-2025-47241),web_tracer,1,unknown,https://reddit.com/r/cybersecurity/comments/1kvvvza/zeroclick_agent_hijacking_in_llm_browsing/,2025-05-26T20:03:53
reddit,1lbnrfh,Cyber risk prioritization,livplay,37,unknown,https://reddit.com/r/cybersecurity/comments/1lbnrfh/cyber_risk_prioritization/,2025-06-15T06:19:21
reddit,1l8n1oi,0-day Total Vehicle Remote Control | CISA,http-mod-raul,87,unknown,https://reddit.com/r/cybersecurity/comments/1l8n1oi/0day_total_vehicle_remote_control_cisa/,2025-06-11T13:36:11
reddit,1kw9spd,How to deal with Curl vulnerabilities in Microsoft products,Ok_Dragonfruit_3379,26,unknown,https://reddit.com/r/cybersecurity/comments/1kw9spd/how_to_deal_with_curl_vulnerabilities_in/,2025-05-27T05:49:26
reddit,1l9klc6,Found a critical RCE in Bosch Telex RDC used by 911 and critical infrastructure!!,Agreeable_Cod3,67,unknown,https://reddit.com/r/cybersecurity/comments/1l9klc6/found_a_critical_rce_in_bosch_telex_rdc_used_by/,2025-06-12T17:28:01
reddit,1lhgxib,How are you framing cyber risk for execs and boards?,On-Demand-Cyber-CRQ,12,unknown,https://reddit.com/r/cybersecurity/comments/1lhgxib/how_are_you_framing_cyber_risk_for_execs_and/,2025-06-22T11:38:13
reddit,1ld3apg,Is there any API or open-source project that publishes new vulnerabilities with remediation details?,Personal-Work4649,3,unknown,https://reddit.com/r/cybersecurity/comments/1ld3apg/is_there_any_api_or_opensource_project_that/,2025-06-17T01:40:30
reddit,1l2f8ol,My open-source Cyber Threat Intelligence project update (MCP integration),KendineYazilimci,4,unknown,https://reddit.com/r/cybersecurity/comments/1l2f8ol/my_opensource_cyber_threat_intelligence_project/,2025-06-03T21:13:17
reddit,1l9js7z,Two Distinct Botnets Exploit Wazuh Server Vulnerability to Launch Mirai-Based Attacks,2hau,2,unknown,https://reddit.com/r/cybersecurity/comments/1l9js7z/two_distinct_botnets_exploit_wazuh_server/,2025-06-12T16:42:52
reddit,1kxqveu,Sign in with ChatGPT,Electronic-Ad6523,2,unknown,https://reddit.com/r/cybersecurity/comments/1kxqveu/sign_in_with_chatgpt/,2025-05-29T01:29:20
reddit,1lajemz,Top cybersecurity stories for the week of 06-09-25 to 06-13-25,CISO_Series_Producer,0,unknown,https://reddit.com/r/cybersecurity/comments/1lajemz/top_cybersecurity_stories_for_the_week_of_060925/,2025-06-13T21:21:18
reddit,1l9s0eu,Vulnerability Reoccurrence Rate and Enterprise Architecture,Expert-Dragonfly-715,1,unknown,https://reddit.com/r/cybersecurity/comments/1l9s0eu/vulnerability_reoccurrence_rate_and_enterprise/,2025-06-12T22:42:29
reddit,1l3tnfx,"Serious bug on OneDrive, vulnerability exposes user data to security risks",davideownzall,18,unknown,https://reddit.com/r/cybersecurity/comments/1l3tnfx/serious_bug_on_onedrive_vulnerability_exposes/,2025-06-05T13:33:25
reddit,1lelb2z,I'm a general dentist diving into cybersecurity as a hobby-curious to hear your thoughts on turning ,Numbnuts720,0,unknown,https://reddit.com/r/cybersecurity/comments/1lelb2z/im_a_general_dentist_diving_into_cybersecurity_as/,2025-06-18T21:48:14
reddit,1lg4g1l,My New PenTesting tool on the block!,Upper_Lychee_8814,0,unknown,https://reddit.com/r/cybersecurity/comments/1lg4g1l/my_new_pentesting_tool_on_the_block/,2025-06-20T19:18:20
reddit,1le2f11,"For people who have discovered zero day exploits being publicly exploited, how?",Professional-Dork26,50,unknown,https://reddit.com/r/cybersecurity/comments/1le2f11/for_people_who_have_discovered_zero_day_exploits/,2025-06-18T05:07:11
reddit,1lgy1zw,"CPTS, CBBH, eCTHP – do I still need OSCP to get hired as a pentester?",BlackbeardElias,18,unknown,https://reddit.com/r/cybersecurity/comments/1lgy1zw/cpts_cbbh_ecthp_do_i_still_need_oscp_to_get_hired/,2025-06-21T20:07:43
reddit,1kztdwo,What should I do to level up?,PsychologicalPass111,40,unknown,https://reddit.com/r/cybersecurity/comments/1kztdwo/what_should_i_do_to_level_up/,2025-05-31T15:22:50
reddit,1ktudwc,"[Open Source Release] OpenVulnScan – A Lightweight, Agent + Nmap + ZAP-Powered Vulnerability Scanner",sudophantom,57,unknown,https://reddit.com/r/cybersecurity/comments/1ktudwc/open_source_release_openvulnscan_a_lightweight/,2025-05-24T02:27:54
reddit,1l31qly,Known pain points with Application Security products?,UXgirly_,0,unknown,https://reddit.com/r/cybersecurity/comments/1l31qly/known_pain_points_with_application_security/,2025-06-04T15:35:43
reddit,1lim3k5,"I made a FOSS Python template with CI/CD security in mind (SLSA L3), yet easy to use (one click/comm",szymonmaszke,4,unknown,https://reddit.com/r/cybersecurity/comments/1lim3k5/i_made_a_foss_python_template_with_cicd_security/,2025-06-23T22:33:45
reddit,1ldyqh1,"WebDeface Monitor – Open-source, AI-powered web-defacement detection",bcdefense,3,unknown,https://reddit.com/r/cybersecurity/comments/1ldyqh1/webdeface_monitor_opensource_aipowered/,2025-06-18T02:29:39
reddit,1lavs01,🚀 Announcing Vishu (MCP) Suite - An Open-Source LLM Agent for Vulnerability Scanning &amp; Reporting,Rule_Curious,0,unknown,https://reddit.com/r/cybersecurity/comments/1lavs01/announcing_vishu_mcp_suite_an_opensource_llm/,2025-06-14T06:10:21
reddit,1l4tuk5,Top cybersecurity stories for the week of 06-02-25 to 06-06-25,CISO_Series_Producer,3,unknown,https://reddit.com/r/cybersecurity/comments/1l4tuk5/top_cybersecurity_stories_for_the_week_of_060225/,2025-06-06T19:59:31
reddit,1l31dkq,What’s your strategy to reduce false positives in vulnerability scans?,Competitive_Rip7137,6,unknown,https://reddit.com/r/AskNetsec/comments/1l31dkq/whats_your_strategy_to_reduce_false_positives_in/,2025-06-04T15:12:30
reddit,1l1x5ii,API Integration - Developing API integrations  to capture data relevant to the vulnerability managem,Pure_Substance_2905,2,unknown,https://reddit.com/r/AskNetsec/comments/1l1x5ii/api_integration_developing_api_integrations_to/,2025-06-03T05:02:36
reddit,1l1wqor,Automating Vulnerability Management,Pure_Substance_2905,2,unknown,https://reddit.com/r/AskNetsec/comments/1l1wqor/automating_vulnerability_management/,2025-06-03T04:44:07
reddit,1kvww60,What client-side JavaScript SAST rules can be helpful to identify potential vulnerabilities?,ExtensionAnything404,2,unknown,https://reddit.com/r/AskNetsec/comments/1kvww60/what_clientside_javascript_sast_rules_can_be/,2025-05-26T20:45:24
reddit,1ktbbci,"DefectDojo: question about vulnerabilities' ""Severity"" field",Intrepid-Command9201,1,unknown,https://reddit.com/r/AskNetsec/comments/1ktbbci/defectdojo_question_about_vulnerabilities/,2025-05-23T10:26:46
reddit,1lakeql,Realistic risks of EOS hardware as VPN gateway/edge device,ImpostureTechAdmin,4,unknown,https://reddit.com/r/AskNetsec/comments/1lakeql/realistic_risks_of_eos_hardware_as_vpn/,2025-06-13T22:01:46
reddit,1l6q2c6,New feature - Potential security issue,lowkib,6,unknown,https://reddit.com/r/AskNetsec/comments/1l6q2c6/new_feature_potential_security_issue/,2025-06-09T04:58:40
reddit,1lgmzou,My recent deep dive into WebRTC security - more to it than I thought!,videosdk_live,7,unknown,https://reddit.com/r/AskNetsec/comments/1lgmzou/my_recent_deep_dive_into_webrtc_security_more_to/,2025-06-21T09:02:58
reddit,1l8dszj,DevSecOps Improvement,lowkib,3,unknown,https://reddit.com/r/AskNetsec/comments/1l8dszj/devsecops_improvement/,2025-06-11T05:00:05
reddit,1ky4zu3,Exploiting File upload !!,SeaTwo5759,2,unknown,https://reddit.com/r/AskNetsec/comments/1ky4zu3/exploiting_file_upload/,2025-05-29T13:20:10
reddit,1lfywfh,What Feature Do You Think Makes or Breaks a Security Tool?,Competitive_Rip7137,0,unknown,https://reddit.com/r/AskNetsec/comments/1lfywfh/what_feature_do_you_think_makes_or_breaks_a/,2025-06-20T14:05:26
reddit,1lhnfhr,How does one register for a CVE these days?,pipewire,3,unknown,https://reddit.com/r/AskNetsec/comments/1lhnfhr/how_does_one_register_for_a_cve_these_days/,2025-06-22T18:36:20
reddit,1ktbbci,"DefectDojo: question about vulnerabilities' ""Severity"" field",Intrepid-Command9201,1,unknown,https://reddit.com/r/AskNetsec/comments/1ktbbci/defectdojo_question_about_vulnerabilities/,2025-05-23T10:26:46
stackoverflow,60174,How can I prevent SQL injection in PHP?,Andrew G. Johnson,2769,high,https://stackoverflow.com/questions/60174/how-can-i-prevent-sql-injection-in-php,2008-09-13T05:25:00
stackoverflow,244882,What is the best way to implement &quot;remember me&quot; for a website?,Eddie Deyo,554,unknown,https://stackoverflow.com/questions/244882/what-is-the-best-way-to-implement-remember-me-for-a-website,2008-10-29T02:39:15
stackoverflow,3720720,How serious is this new ASP.NET security vulnerability and how can I workaround it?,Venemo,192,medium,https://stackoverflow.com/questions/3720720/how-serious-is-this-new-asp-net-security-vulnerability-and-how-can-i-workaround,2010-09-16T00:14:37
stackoverflow,134099,Are PDO prepared statements sufficient to prevent SQL injection?,Mark Biek,744,high,https://stackoverflow.com/questions/134099/are-pdo-prepared-statements-sufficient-to-prevent-sql-injection,2008-09-25T21:13:35
stackoverflow,7459630,How can a Format-String vulnerability be exploited?,Atul Goyal,69,critical,https://stackoverflow.com/questions/7459630/how-can-a-format-string-vulnerability-be-exploited,2011-09-18T10:47:56
