platform,post_id,title,author,created_date,score,comments_count,severity,url,tags,content_preview
stackoverflow,60174,How can I prevent SQL injection in PHP?,Andrew G. Johnson,2008-09-13T05:25:00,2769,27,high,https://stackoverflow.com/questions/60174/how-can-i-prevent-sql-injection-in-php,"php, mysql, sql, security, sql-injection, vulnerability","<p>If user input is inserted without modification into an SQL query, then the application becomes vulnerable to <a href=""https://stackoverflow.com/a/332367/"">SQL injection</a>, like in the following e..."
stackoverflow,244882,What is the best way to implement &quot;remember me&quot; for a website?,Eddie Deyo,2008-10-29T02:39:15,554,4,unknown,https://stackoverflow.com/questions/244882/what-is-the-best-way-to-implement-remember-me-for-a-website,"security, cookies, remember-me, vulnerability",<p>I want my website to have a checkbox that users can click so that they will not have to log in each time they visit my website. I know I will need to store a cookie on their computer to implement t...
stackoverflow,3720720,How serious is this new ASP.NET security vulnerability and how can I workaround it?,Venemo,2010-09-16T00:14:37,192,10,medium,https://stackoverflow.com/questions/3720720/how-serious-is-this-new-asp-net-security-vulnerability-and-how-can-i-workaround,"asp.net, .net, security, padding-oracle-attack, vulnerability","<p>I've just read on the net about a newly discovered security vulnerability in ASP.NET. <a href=""http://threatpost.com/en_us/blogs/new-crypto-attack-affects-millions-aspnet-apps-091310"" rel=""noreferr..."
stackoverflow,134099,Are PDO prepared statements sufficient to prevent SQL injection?,Mark Biek,2008-09-25T21:13:35,744,7,high,https://stackoverflow.com/questions/134099/are-pdo-prepared-statements-sufficient-to-prevent-sql-injection,"php, security, pdo, sql-injection, vulnerability","<p>Let's say I have code like this:</p> <pre><code>$dbh = new PDO(""blahblah""); $stmt = $dbh-&gt;prepare('SELECT * FROM users where username = :username'); $stmt-&gt;execute( array(':username' =&gt; ..."
stackoverflow,7459630,How can a Format-String vulnerability be exploited?,Atul Goyal,2011-09-18T10:47:56,69,6,critical,https://stackoverflow.com/questions/7459630/how-can-a-format-string-vulnerability-be-exploited,"c, security, format-string, vulnerability","<p>I was reading about vulnerabilities in code and came across this <em>Format-String Vulnerability</em>. </p> <p><a href=""http://en.wikipedia.org/wiki/Uncontrolled_format_string"" rel=""noreferrer"">Wi..."
stackoverflow,70310980,Log4j vulnerability - Is Log4j 1.2.17 vulnerable (was unable to find any JNDI code in source)?,Ravindra HV,2021-12-11T03:49:20,63,3,critical,https://stackoverflow.com/questions/70310980/log4j-vulnerability-is-log4j-1-2-17-vulnerable-was-unable-to-find-any-jndi-co,"java, security, log4j, log4j2, exploit, vulnerability","<p>With regard to the <a href=""https://en.wikipedia.org/wiki/Log4j"" rel=""noreferrer"">Log4j</a> <a href=""https://en.wikipedia.org/wiki/Java_Naming_and_Directory_Interface"" rel=""noreferrer"">JNDI</a> rem..."
stackoverflow,42815858,GlassFish Directory Disclosure Vulnerability,Chrystian Garcia,2017-03-15T22:14:22,2,1,unknown,https://stackoverflow.com/questions/42815858/glassfish-directory-disclosure-vulnerability,"security, directory, glassfish, vulnerability","<p>I have a Glassfish 4.1.1 server, there a vulnerability scan with MCafee Vulnerability Manager find that the server have Apache Tomcat Directory Disclosure Vulnerability [FID 10109] on admin server ..."
stackoverflow,70344760,SonarQube log4j Vulnerability,Akshay Singh,2021-12-14T12:21:59,0,1,critical,https://stackoverflow.com/questions/70344760/sonarqube-log4j-vulnerability,"security, sonarqube, log4j, vulnerability","<p>How to detect the log4j vulnerability in SonarQube LTS 8.2 version any script for that.</p> <p>I tried this community reference but not able to find for 8.2 version.</p> <p><a href=""https://communi..."
stackoverflow,10117308,glibc fnmatch vulnerability: how to expose the vulnerability?,woodstok,2012-04-12T09:48:54,1,2,critical,https://stackoverflow.com/questions/10117308/glibc-fnmatch-vulnerability-how-to-expose-the-vulnerability,"linux, security, glibc, vulnerability","<p>I have to validate a vulnerability on one of our 64-bit systems which is running glibc-2.9 .</p> <p><a href=""http://scarybeastsecurity.blogspot.in/2011/02/i-got-accidental-code-execution-via.html""..."
stackoverflow,41820273,Libpng vulnerability,Liya,2017-01-24T10:25:30,0,2,unknown,https://stackoverflow.com/questions/41820273/libpng-vulnerability,"android, security, opencv, libpng, vulnerability",<p>My application is for live video streaming and recording (both audio and video) using wifi. uses following dependencies: </p> <pre><code>repositories { maven { url 'https://raw.github.com/iParse/a...
stackoverflow,41349700,TOCTTOU code vulnerability,user7346822,2016-12-27T23:12:41,0,1,unknown,https://stackoverflow.com/questions/41349700/tocttou-code-vulnerability,"security, vulnerability","<p>I have a piece of code in C, and I need to know where I have the TOCTTOU vulnerability and why. Does somebody know where it is and how I can correct it?</p> <pre><code>int process(char *filename) ..."
stackoverflow,20504846,Why is it common to put CSRF prevention tokens in cookies?,metamatt,2013-12-11T02:15:31,446,5,critical,https://stackoverflow.com/questions/20504846/why-is-it-common-to-put-csrf-prevention-tokens-in-cookies,"http, security, cookies, csrf, owasp, vulnerability","<p>I'm trying to understand the whole issue with CSRF and appropriate ways to prevent it. (Resources I've read, understand, and agree with: <a href=""https://cheatsheetseries.owasp.org/cheatsheets/Cros..."
stackoverflow,38272528,Hidden Web pages vulnerability,user6400807,2016-07-08T23:10:19,0,1,unknown,https://stackoverflow.com/questions/38272528/hidden-web-pages-vulnerability,"security, hidden, vulnerability","<p>I have written an application using struts2 and tiles running on tomcat 7. The core impact vulnerability scan came back with ""Hidden Pages Vulnerability - Backup Web Pages"" listing around 5 links. ..."
stackoverflow,64111572,Kubernetes Vulnerability Scanner,user14358171,2020-09-29T06:46:18,2,1,critical,https://stackoverflow.com/questions/64111572/kubernetes-vulnerability-scanner,"security, kubernetes, vulnerability","<p>I am looking for options to integrate a vulnerability scanner with K8s. As a deployment is created, the scanner will scan the docker image/container and deliver results via json or yaml. Is there a..."
stackoverflow,24527319,Graph database vulnerability,deus,2014-07-02T14:49:07,2,3,unknown,https://stackoverflow.com/questions/24527319/graph-database-vulnerability,"security, neo4j, graph-databases, vulnerability","<p>Are there any vulnerability to graph databases ( if to be specific, then especially <strong>Neo4j v2.0</strong> ) like SQL-injection in SQL based databases and how to overcome them when implementin..."
stackoverflow,9352023,XSS vulnerability: &lt;wslite&gt;,user1149501,2012-02-20T00:12:47,2,1,high,https://stackoverflow.com/questions/9352023/xss-vulnerability-wslite,"php, security, xss, vulnerability",<p>A scurity report for my website show this vulnerability:</p> <pre><code>Relflected XSS: Request: GET http://example.com/page.php?q=&lt; wslite &gt; HTTP/1.1 </code></pre> <p>what is the meaning...
stackoverflow,77926075,EJS vulnerability in Electron,Wawan,2024-02-02T15:25:22,0,0,critical,https://stackoverflow.com/questions/77926075/ejs-vulnerability-in-electron,"security, electron, ejs, vulnerability","<p>We have application deployed using Electron for Singapore government project. We are having reported vulnerability for EJS, which is included in Electron that has critical vulnerability reported <a..."
stackoverflow,12169902,JRE 1.7 Vulnerability,Philip Tenn,2012-08-29T07:23:41,5,2,critical,https://stackoverflow.com/questions/12169902/jre-1-7-vulnerability,"security, java, java-7, vulnerability","<p>Today, our Enterprise Architect mentioned that a recent vulnerability was discovered in the JRE 1.7. I found an article the <a href=""http://www.theregister.co.uk/2012/08/27/disable_java_to_block_e..."
stackoverflow,3752431,RedirectMode in ASP.NET Security Vulnerability,AJM,2010-09-20T20:01:52,3,2,unknown,https://stackoverflow.com/questions/3752431/redirectmode-in-asp-net-security-vulnerability,"asp.net, security, vulnerability","<p><a href=""http://weblogs.asp.net/scottgu/archive/2010/09/18/important-asp-net-security-vulnerability.aspx"" rel=""nofollow noreferrer"">In Scott Guthries blog on the ASP.NET Security vulnerability note..."
stackoverflow,42303200,Is a vulnerability identified in Python considered a vulnerability in Jython?,jimgug,2017-02-17T22:15:43,3,2,unknown,https://stackoverflow.com/questions/42303200/is-a-vulnerability-identified-in-python-considered-a-vulnerability-in-jython,"python, security, jython, cpython, vulnerability","<p>A lil confused as the diffs between Python, Jython and CPython. I understand Jython is an implementation of Python in Java and CPython is the same except that it is implemented in C.</p> <p>But wh..."
stackoverflow,9402974,Scripts folder a vulnerability?,Jagd,2012-02-23T02:35:17,5,5,critical,https://stackoverflow.com/questions/9402974/scripts-folder-a-vulnerability,"javascript, jquery, asp.net, security, vulnerability","<p>In my .NET web applications I usually have a Scripts folder that contains all of my JavaScript files - jQuery mostly these days, with the occasional JavaScript library of some sort or another. </p>..."
stackoverflow,26389313,Simple Explanation of Poodle Vulnerability?,vastlysuperiorman,2014-10-15T23:43:18,0,1,critical,https://stackoverflow.com/questions/26389313/simple-explanation-of-poodle-vulnerability,"security, ssl, vulnerability","<p>Because of my work, I was aware of the POODLE vulnerability within minutes of it being announced. We of course disabled SSL 3.0 everywhere relevant. However, I still don't really understand how the..."
stackoverflow,2322261,jQuery vulnerability (NVD CVE-2007-2379),Dustin Kendall,2010-02-24T04:01:47,2,2,unknown,https://stackoverflow.com/questions/2322261/jquery-vulnerability-nvd-cve-2007-2379,"javascript, jquery, security, vulnerability","<p>We're using jQuery and I've come across the following jQuery vulnerability in the National Vulnerability Database:</p> <p><a href=""http://web.nvd.nist.gov/view/vuln/detail?vulnId=CVE-2007-2379"" re..."
stackoverflow,31689095,Security vulnerability or not?,Li-Fan Yu,2015-07-29T05:28:54,-1,1,unknown,https://stackoverflow.com/questions/31689095/security-vulnerability-or-not,"security, vulnerability","<p>I observed that the web tool project I'm working on has a potential vulnerability, where a well-forged http form request can make the internal server execute arbitrary shell command. </p> <p>Howev..."
stackoverflow,56598235,Where does ServiceStack publish vulnerability information?,yenta,2019-06-14T17:58:48,1,1,unknown,https://stackoverflow.com/questions/56598235/where-does-servicestack-publish-vulnerability-information,"security, servicestack, vulnerability",<p>If a vulnerability were to be discovered for any versions 3/4/5 and a patch were to be released - where would ServiceStack publish vulnerability information?</p>
stackoverflow,35219103,XSS vulnerability protection,Nulik,2016-02-05T13:36:25,-1,1,critical,https://stackoverflow.com/questions/35219103/xss-vulnerability-protection,"security, xss, vulnerability","<p>XSS vulnerability is exploited because the browser stores the cookie with the session id , so any access to the URL of the site you are logged in, goes with privileges of the logged in user.</p> <..."
stackoverflow,6617412,Qualys ID mapping to Common vulnerability exposure,Jackey,2011-07-08T03:03:14,0,1,unknown,https://stackoverflow.com/questions/6617412/qualys-id-mapping-to-common-vulnerability-exposure,"security, vulnerability",<p>Is it possible to map every QualysGuard vulnerability ID to common vulnerability expousre ID (CVE) or vice versa ?</p>
stackoverflow,77765953,Atlassian JWT Authentication Vulnerability,Hakeem Baba,2024-01-05T21:58:46,0,0,critical,https://stackoverflow.com/questions/77765953/atlassian-jwt-authentication-vulnerability,"ruby-on-rails, ruby, security, jwt, confluence, vulnerability","<p>I have a connect app in the Atlassian app marketplace that is failing the JWT authentication vulnerability scanner. Below is a sample of the vulnerability description from the <a href=""https://gith..."
stackoverflow,30341327,Heap Inspection Security Vulnerability,Gaurav Sachdeva,2015-05-20T11:24:34,15,4,unknown,https://stackoverflow.com/questions/30341327/heap-inspection-security-vulnerability,"java, security, heap-memory, static-code-analysis, checkmarx, vulnerability","<p>I have run my java app against the checkmarx tool for security vulnerability and it is constantly giving an issue - Heap Inspection, for my password field for which I use a character array. It does..."
stackoverflow,70337145,Does the Log4j security violation vulnerability affect log4net?,FooAnon,2021-12-13T21:03:17,34,5,unknown,https://stackoverflow.com/questions/70337145/does-the-log4j-security-violation-vulnerability-affect-log4net,"java, c#, security, log4j, log4net, vulnerability","<p>I have recently read about the <a href=""https://en.wikipedia.org/wiki/Zero-day_(computing)"" rel=""noreferrer"">zero-day</a> issue in Log4J. I work with a few applications, written with .NET, that use..."
stackoverflow,17728020,MongoDB findOne with regex (security flaw?),user2306309,2013-07-18T21:10:20,2,1,unknown,https://stackoverflow.com/questions/17728020/mongodb-findone-with-regex-security-flaw,"regex, security, mongodb, security flaw","<p>Before i insert the email into the database -> i validate the adress with </p> <pre><code>if (filter_var($emailAdress, FILTER_VALIDATE_EMAIL)) { .... } </code></pre> <p>.. but is this maybe a sec..."
stackoverflow,7064368,Security flaw with AJAX logins,PeeHaa,2011-08-15T16:54:16,3,4,unknown,https://stackoverflow.com/questions/7064368/security-flaw-with-ajax-logins,"javascript, ajax, security, authentication, security flaw",<p>Many sites nowadays use AJAX to let users login.</p> <p>However there is a (I think) huge security flaw with this design.</p> <p>If the login failed the username/password has been used in a reque...
stackoverflow,13466949,PHP Session Security Flaw?,user1837725,2012-11-20T10:40:19,2,4,unknown,https://stackoverflow.com/questions/13466949/php-session-security-flaw,"php, security, session, security flaw","<p>I'm new to php coding, and basically I'm creating a user panel where users login and from there they access their dashboard which lets them do things.</p> <p>I'm using php sessions to do this, and..."
stackoverflow,8125366,php &quot;include()&quot; security flaw?,Jeff,2011-11-14T22:45:26,2,5,unknown,https://stackoverflow.com/questions/8125366/php-include-security-flaw,"php, security, include, security flaw","<p>In the PHP manual for <code>include</code>, there is a user contribution that states the following:</p> <blockquote> <p>include() when used to load configuration information has a scary securi..."
stackoverflow,2468956,Security flaw in this code approach,Alec Smart,2010-03-18T15:48:00,5,6,critical,https://stackoverflow.com/questions/2468956/security-flaw-in-this-code-approach,"php, security, file-upload, security flaw",<p>Am wondering if there would be any security flaw in this approach. I am writing a piece of code which allows users to upload files and another set to download those files. These files can be anythi...
stackoverflow,16195772,Security Flaw in php form,DextrousDave,2013-04-24T20:45:56,0,2,critical,https://stackoverflow.com/questions/16195772/security-flaw-in-php-form,"php, forms, security, email, security flaw","<p>Apparently my php email form is full of security vulnerabilities, what can I do to fix them?</p> <p>And what i mean by security flaws, that is hackers/bots being able to inject additional headers(..."
stackoverflow,51479000,Security flaws of Firebase,payne,2018-07-23T18:07:22,0,1,unknown,https://stackoverflow.com/questions/51479000/security-flaws-of-firebase,"java, security, google-api, spring-security-oauth2, security flaw","<p>Bear with me, I might be wrong: I'm no security expert.</p> <p>I believe I've been reading about how OAuth 2 does not prevent <code>replay-attacks</code>. What is the suggested way to prevent such..."
stackoverflow,16225935,security flaw - veracode report - crlf injection,david,2013-04-26T04:11:41,14,5,high,https://stackoverflow.com/questions/16225935/security-flaw-veracode-report-crlf-injection,"java, security, jakarta-ee, code-injection, security flaw","<p>I got the veracode report for my javaEE app. It had a flaw at any logging (using log4j), so I add the <code>StringEscapeUtils.escapeJava(log)</code> to all of them, but veracode keeps reporting the..."
stackoverflow,22945406,Is standard Java immune to memcpy security flaws like the recent open ssl heartbeat flaw?,bmillare,2014-04-09T00:01:21,2,1,unknown,https://stackoverflow.com/questions/22945406/is-standard-java-immune-to-memcpy-security-flaws-like-the-recent-open-ssl-heartb,"java, c, security, heartbleed-bug, security flaw","<p>Recently, the library openssl has been revealed to have a serious flaw that enables attackers to read up to 64KB of memory.</p> <p><a href=""http://blog.existentialize.com/diagnosis-of-the-openssl-..."
stackoverflow,32170019,Does Groovy security flaw affect Grails apps?,Philip,2015-08-24T00:00:13,0,1,medium,https://stackoverflow.com/questions/32170019/does-groovy-security-flaw-affect-grails-apps,"security, grails, serialization, groovy, security flaw","<p>A security flaw in Groovy was detected in versions 1.7 to 2.4.3:</p> <p><a href=""http://cve.mitre.org/cgi-bin/cvename.cgi?name=CVE-2015-3253"" rel=""nofollow"">http://cve.mitre.org/cgi-bin/cvename.cg..."
stackoverflow,41108886,WebGL 2011 security flaws?,MingMan,2016-12-13T01:50:50,3,2,critical,https://stackoverflow.com/questions/41108886/webgl-2011-security-flaws,"security, memory, browser, webgl, gpu, security flaw","<p>In 2011 there were a wave of blog posts like <a href=""https://www.contextis.com/resources/blog/webgl-more-webgl-security-flaws/"" rel=""nofollow noreferrer"">https://www.contextis.com/resources/blog/w..."
stackoverflow,69137405,Potential security flaw using create table like,Kerry,2021-09-11T01:23:30,0,1,unknown,https://stackoverflow.com/questions/69137405/potential-security-flaw-using-create-table-like,"security, data-masking, snowflake-cloud-data-platform, security flaw","<p>I've discovered an unexpected result while using data masking on tables. I have a process, running in an elevated role, that loads a table with sensitive data. Because the ingested data is effect..."
stackoverflow,16143548,Paypal Security Flaw?,Chud37,2013-04-22T14:53:04,2,1,critical,https://stackoverflow.com/questions/16143548/paypal-security-flaw,"php, security, paypal, paypal-ipn, security flaw","<p>I have a the following form at the end of a booking process (simplified):</p> <pre><code>&lt;form action=""https://www.paypal.com/cgi-bin/webscr"" name=""paypalForm"" method=""post""&gt; &lt;input type=..."
stackoverflow,2951917,Historical security flaws of popular PHP CMS&#39;s?,VirtuosiMedia,2010-06-01T23:01:36,38,9,unknown,https://stackoverflow.com/questions/2951917/historical-security-flaws-of-popular-php-cmss,"php, security, content-management-system, password-protection, security flaw","<p>I'm creating a PHP CMS, one that I hope will be used by the public. Security is a major concern and I'd like to learn from some of the popular PHP CMS's like Wordpress, Joomla, Drupal, etc. What ar..."
stackoverflow,14130888,PHP &quot;Remember Me&quot; security flaw?,Scott,2013-01-03T04:58:11,12,4,unknown,https://stackoverflow.com/questions/14130888/php-remember-me-security-flaw,"php, security, authentication, remember-me, security flaw","<p>I'm in the middle of coding a 'remember me'-equipped login form, and so far the tutorials I've read (partly to make sure I'm doing it right) all say to store the encrypted password in a cookie alon..."
stackoverflow,51050674,Does knowing one encrypted character open up a security flaw?,Toby Smith,2018-06-27T01:39:08,0,1,unknown,https://stackoverflow.com/questions/51050674/does-knowing-one-encrypted-character-open-up-a-security-flaw,"php, security, encryption, cryptography, encryption-symmetric, security flaw","<p>One of the columns in a table in my API's database is an encrypted text formed of two pieces of information concatenated with a given delimiter, lets say a colon. The second piece of information is..."
stackoverflow,20325132,AES encryption &amp; security flaw,pulancheck1988,2013-12-02T15:15:24,0,3,unknown,https://stackoverflow.com/questions/20325132/aes-encryption-security-flaw,"java, android, security, aes, md5, security flaw","<p><em>Check <strong>update#1</em></strong></p> <p>This logic is a candidate for a authentication procedure, done by simple HTTP requests:</p> <ul> <li>I'm sending: userName + encrypted_userName (en..."
stackoverflow,26759372,Asp.Net webresource.axd open redirection security flaw?,Frode,2014-11-05T19:45:45,7,0,critical,https://stackoverflow.com/questions/26759372/asp-net-webresource-axd-open-redirection-security-flaw,"c#, asp.net, .net, security, security flaw",<p>Running WebResource.axd through Burpe Suite’s active scan gave indication of a possible open redirection flaw in the function WebForm_DoCallback. This function does a post based upon a generated ur...
stackoverflow,7175675,security flaw in c code snippet?,lallo,2011-08-24T18:17:07,2,6,unknown,https://stackoverflow.com/questions/7175675/security-flaw-in-c-code-snippet,"c, security, security flaw",<p>There is supposedly something wrong (in terms of software security) with this code snippet and i cant seem to figure it out ...The function die terminates the the program after displaying the strin...
stackoverflow,8550932,Security: How come we still hear about many stack execution security flaws?,thedrs,2011-12-18T15:20:09,3,0,critical,https://stackoverflow.com/questions/8550932/security-how-come-we-still-hear-about-many-stack-execution-security-flaws,"security, exploit, aslr, nomachine-nx, dep, security flaw","<p>Security: How come we still hear about many stack execution security flaws even though mechanisms such as <a href=""http://en.wikipedia.org/wiki/NX_bit"" rel=""nofollow"">NX bit</a> <a href=""http://en...."
stackoverflow,9468405,How to expose security flaws in my website,PTBG,2012-02-27T21:52:36,1,3,critical,https://stackoverflow.com/questions/9468405/how-to-expose-security-flaws-in-my-website,"security, web, security flaw","<p>Is there any service, or test suite or something which I can run against my site and expose any major security flaws. I don't expect I'll need to worry about hackers, but I want to eliminate securi..."
stackoverflow,6773589,PHP Security Flaws?,Travis,2011-07-21T14:29:40,-1,2,unknown,https://stackoverflow.com/questions/6773589/php-security-flaws,"java, php, security, security flaw",<p>Our team is developing a web app in the financial space using PHP. The big question that comes up first is always security related. What are the main security risks associated with PHP or scripted ...
stackoverflow,16333806,Security flaws : How to avert them?,The Dark Knight,2013-05-02T14:16:48,1,1,unknown,https://stackoverflow.com/questions/16333806/security-flaws-how-to-avert-them,"java, javascript, security, jsp, jstl, security flaw",<p>I am in a bit of a pickle :</p> <p>I have a lot of values which i am setting in a bean in java and then i am getting them in javascript and jsp using scriplets like this :</p> <p><strong>In My ...
stackoverflow,55430170,CLR assemblies can bring a security flaw to the SQL Server instance,krisurnok,2019-03-30T15:19:01,1,1,critical,https://stackoverflow.com/questions/55430170/clr-assemblies-can-bring-a-security-flaw-to-the-sql-server-instance,"sql, sql-server, security, security flaw",<p>I have run the SSMS Vulnerability Assessment. <br/> In the result it give <b>4</b> total Failing checks.</p> <p>In the 4 failing 1 is CLR assembly. <br/> VA1256 - User CLR assemblies should not be...
stackoverflow,16765652,Security Flaws?,jadeallencook,2013-05-27T08:04:40,4,5,unknown,https://stackoverflow.com/questions/16765652/security-flaws,"php, security, security flaw","<p>What are the repercussions of using this code?</p> <pre><code>&lt;?php if(file_exists(""pages/"" . $_GET[""page""] . "".php"")){ include(""pages/"" . $_GET[""page""] . "".php""); } else{ inclu..."
stackoverflow,6830359,Security flaws in code with veracode tool,BOSS,2011-07-26T18:27:54,3,4,high,https://stackoverflow.com/questions/6830359/security-flaws-in-code-with-veracode-tool,"java, security, web-applications, veracode, security flaw",<p>i ran my application for security compilance in veracode tool. And whenever the tool find any logging it detected as a flaw in code<br> And the flaw says below quote</p> <p><strong>Improper Output...
stackoverflow,14225179,Rails Security Patch: SQL Injection Flaw,ramz15,2013-01-09T04:00:26,2,1,high,https://stackoverflow.com/questions/14225179/rails-security-patch-sql-injection-flaw,"ruby-on-rails, ruby-on-rails-3, security, ruby-on-rails-3.2, sql-injection, security flaw","<p>I need to apply the latest Rails security patch from the newly discovered SQL injection flaw. </p> <p>I'm using Rails 3.2.3 and found this patch file ( <a href=""https://rubyonrails-security.google..."
